Title,Description,Publisher,Link,Published Time,processed_text
Non-small cell lung cancer detection through knowledge distillation approach with teaching assistant,"Non-small cell lung cancer (NSCLC) exhibits a comparatively slower rate of metastasis in contrast to small cell lung cancer, contributing to approximately 85% of the global patient population. In this work, leveraging CT scan images, we deploy a knowledge dis…",Plos.org,https://journals.plos.org/plosone/article?id=10.1371/journal.pone.0306441,06-11-2024 14:00,nonsmall cell lung cancer nsclc exhibit comparatively slower rate metastasis contrast small cell lung cancer contributing approximately global patient population work leveraging ct scan image deploy knowledge dis
Oro-facial filariasis–A systematic review of the literature,"Author summary Although, filarial parasites can in theory affect the oro-facial space little is to date known on whether oro-facial involvement occurs in the course of filarial infection. Therefore, we conducted a review of the published scientific literature…",Plos.org,https://journals.plos.org/plosntds/article?id=10.1371/journal.pntd.0012610,06-11-2024 14:00,author summary although filarial parasite theory affect orofacial space little date known whether orofacial involvement occurs course filarial infection therefore conducted review published scientific literature
Highlights from October’s ProductTank meetups,"Read the highlights from October ProductTanks, we hosted 60 meetups around the world, and in this article we will highlight a few. Read more »
The post Highlights from October’s ProductTank meetups appeared first on Mind the Product.",Mindtheproduct.com,https://www.mindtheproduct.com/highlights-from-octobers-producttank-meetups/,06-11-2024 14:00,read highlight october producttanks hosted meetups around world article highlight read post highlight october producttank meetups appeared first mind product
"Stranger Things 5 Confirms 2025 Release Date, Unveils All 8 Episode Titles","On Stranger Things Day 2024 Netflix revealed the 2025 release date of Stranger Things 5 and every season 5 episode title, including the series finale.",Teen Vogue,https://www.teenvogue.com/story/stranger-things-5-confirms-2025-release-date-unveils-all-8-episode-titles,06-11-2024 14:00,stranger thing day netflix revealed release date stranger thing every season episode title including series finale
GM software boss still thinks ditching Apple CarPlay is smart,GM in 2023 started phasing out Apple CarPlay and Android Auto on some vehicles GM's software boss said automaker wants more control of vehicle's user interface Next-gen Apple CarPlay set to take even more control of user interface Anyone who is a frequent use…,Motor Authority,https://www.motorauthority.com/news/1144946_gm-software-boss-still-thinks-ditching-apple-carplay-is-smart,06-11-2024 14:00,gm started phasing apple carplay android auto vehicle gm software bos said automaker want control vehicle user interface nextgen apple carplay set take even control user interface anyone frequent use
Android 16 Set For June 3rd? Pixel 9 Series May Get It First,The current generation of Google Pixels will get the new OS before any other.,TalkAndroid,https://www.talkandroid.com/493633-android-16-june-3rd/,06-11-2024 14:00,current generation google pixel get new o
The effects of seasonal human mobility and Aedes aegypti habitat suitability on Zika virus epidemic severity in Colombia,"Author summary The Zika virus pandemic of 2015–16, which caused over 1 million human cases in the Caribbean and Latin America, was driven by a combination of movement of infected humans and presence of mosquito species, such as Aedes aegypti, that carry the d…",Plos.org,https://journals.plos.org/plosntds/article?id=10.1371/journal.pntd.0012571,06-11-2024 14:00,author summary zika virus pandemic caused million human case caribbean latin america driven combination movement infected human presence mosquito specie aedes aegypti carry
Here’s What Billionaires Are Saying Online In Response To Trump’s Victory,"Most of America’s billionaires are staying silent on X, formerly Twitter, about the presidential election. But some—including Musk, Ramaswamy and Ackman—are very vocal.",Forbes,https://www.forbes.com/sites/kylemullins/2024/11/06/what-billionaires-saying-in-response-trump-victory-harris-presidential-election/,06-11-2024 13:58,america billionaire staying silent x formerly twitter presidential election someincluding musk ramaswamy ackmanare vocal
The Great Betrayal Of Batman At DC Comics Today (Spoilers),"Today, we see the publication of Batman #154 by Chip Zdarsky and Carmine Di Giandomenico. And it's a big one. The last issue, Batman #153, kicking off Zdarsky's final arc on the series, saw the assassination of Mayor Nakano and the revelation that Bruce Wayne…",Bleeding Cool News,https://bleedingcool.com/comics/great-betrayal-batman-dc-spoilers/,06-11-2024 13:57,today see publication batman chip zdarsky carmine di giandomenico big one last issue batman kicking zdarskys final arc series saw assassination mayor nakano revelation bruce wayne
"LG’s beloved 2024 120Hz C4 OLED smart TV with AirPlay just hit the $1,394 Amazon low (Up to $1,300 off)","Amazon is now offering its best price yet on one of the most beloved 2024 OLED smart TVs in the game. You can now score the latest LG 65-inch Class OLED evo C4 Series Smart TV down at $1,394 shipped. This model launched earlier this year in February at $2,700…",9to5Toys,http://9to5toys.com/2024/11/06/lg-2024-120hz-c4-oled-smart-tv-airplay/,06-11-2024 13:55,amazon offering best price yet one beloved oled smart tv game score latest lg inch class oled evo c series smart tv shipped model launched earlier year february
5 things to know before the stock market opens Wednesday - CNBC,5 things to know before the stock market opens WednesdayCNBC View Full Coverage on Google News ...,Slashdot.org,https://slashdot.org/firehose.pl?op=view&amp;id=175416715,06-11-2024 13:52,thing know stock market open wednesdaycnbc view full coverage google news
Deadeye Ash Williams Rises with Asmus Toys New Evil Dead Figure,"Return to the events of Evil Dead II with Asmus Toys as they open the Necronomicon with a new 1/6 scale figure. Ash Williams is back, embracing the darkness and becoming a Deadite after his encounter with the cursed Necronomicon Ex-Mortis in the secluded cabi…",Bleeding Cool News,https://bleedingcool.com/collectibles/deadeye-ash-williams-rises-with-asmus-toys-new-evil-dead-figure/,06-11-2024 13:52,return event evil dead ii asmus toy open necronomicon new scale figure ash williams back embracing darkness becoming deadite encounter cursed necronomicon exmortis secluded cabi
New report reveals the exact Android 16 launch date,"Google confirmed that Android 16 will launch in Q2 of 2025, and now we have the exact date of launch along with a few key details. Read more...",Neowin,https://www.neowin.net/news/new-report-reveals-the-exact-android-16-launch-date/,06-11-2024 13:52,google confirmed android launch q exact date launch along key detail read
"How Trump’s Second Administration Affects Business: Musk, Tariffs and More","Donald Trump’s return to the White House after winning the Nov. 5 U.S. presidential election may reshape American business. Much depends on whom he appoints as deputies and cabinet members, including the role of Tesla CEO Elon Musk, and what …",Insurance Journal,https://www.insurancejournal.com/news/national/2024/11/06/800274.htm,06-11-2024 13:50,donald trump return white house winning nov u presidential election may reshape american business much depends appoints deputy cabinet member including role tesla ceo elon musk
Donate your old dish drying rack and upgrade to Joseph Joseph’s stainless steel model at $25 (Reg. $45),"Joseph Joseph Stainless Steel Expanding Dish Drying Rack



Buy for $25 (Reg. $45)














What we love




If you have a more utilitarian dish rack around the house, it may be time to donate it and upgrade to this premium model from Joseph Joseph. I…",9to5Toys,http://9to5toys.com/2024/11/06/joseph-joseph-stainless-steel-expanding-dish-rack/,06-11-2024 13:49,joseph joseph stainless steel expanding dish drying rack buy reg love utilitarian dish rack around house may time donate upgrade premium model joseph joseph
"After Donald Trump's accusations of bias, Google CEO Sundar Pichai had a message for employees at the brink of US election day","Google CEO Sundar Pichai, in an internal memo, emphasized the importance of providing reliable election information to users globally.  Pichai acknowledged Google's role in supporting elections worldwide and urged employees to maintain the company's position …",The Times of India,https://economictimes.indiatimes.com/news/international/world-news/after-donald-trumps-accusations-of-bias-google-ceo-sundar-pichai-had-a-message-for-employees-at-the-brink-of-us-election-day/articleshow/115021312.cms,06-11-2024 13:46,google ceo sundar pichai internal memo emphasized importance providing reliable election information user globally pichai acknowledged google role supporting election worldwide urged employee maintain company position
Save $50 Off Samsung’s Galaxy Tab A9+ 11-Inch Tablet While You Still Can,"It can be easy to think that the only tablets available right now are iPads, and there is no doubt that Apple's iPad lineup is full of best-in-class options. But, they're no use if you're already in the Android ecosystem, and thankfully there are plenty of An…",redmondpie.com,https://www.redmondpie.com/save-50-off-samsungs-galaxy-tab-a9-11-inch-tablet-while-you-still-can/,06-11-2024 13:44,easy think tablet available right ipads doubt apple ipad lineup full bestinclass option theyre use youre already android ecosystem thankfully plenty
Spring flights from the Baltic countries to New York from €393,"Finnar is offering cheap flights from Tallinn, Riga & Vilnius to New York starting at only €393 for a round trip!",Fly4free.com,https://www.fly4free.com/flight-deals/europe/flights-from-the-baltics-to-new-york-e393/,06-11-2024 13:40,finnar offering cheap flight tallinn riga vilnius new york starting round trip
Thailand readies strategy to prosper in Trump era,"<p>Thailand will explore offering fresh <strong>incentives</strong> to attract global companies looking to minimise the hit from a US-China <strong>trade war</strong> that is expected to intensify under a <strong>Donald Trump</strong> presidency, says Commerc…",Bangkok Post,https://www.bangkokpost.com/business/general/2897412/thailand-readies-strategy-to-prosper-in-trump-era,06-11-2024 13:40,pthailand explore offering fresh strongincentivesstrong attract global company looking minimise hit uschina strongtrade warstrong expected intensify strongdonald trumpstrong presidency say commerc
"Trump expected to shift course on antitrust, stop Google breakup","In This Article:
By Jody Godoy
(Reuters) - Donald Trump will likely dial back some of the antitrust policies pursued under the administration of President Joe Biden, potentially including a bid to break up Alphabet's Google over its dominance in online search…",Biztoc.com,https://biztoc.com/x/21d8b4d4e9b4c081,06-11-2024 13:39,article jody godoy reuters donald trump likely dial back antitrust policy pursued administration president joe biden potentially including bid break alphabet google dominance online search
Doctor Who: Children in Need Auctioning Jodie Whittaker's TARDIS,"Doctor Who is a major part of BBC's annual Children in Need charity event, and this year is no different. This year, fans will have the chance to bid for Jodie Whittaker's TARDIS, which was used on set in the 2022 New Year's Special Eve of the Daleks. It is t…",Bleeding Cool News,https://bleedingcool.com/tv/doctor-who-children-in-need-auctioning-jodie-whittakers-tardis/,06-11-2024 13:37,doctor major part bbcs annual child need charity event year different year fan chance bid jodie whittakers tardis used set new year special eve daleks
"Donald Trump expected to shift course on antitrust, stop Google breakup","Trump is expected to continue cases against Big Tech, several of which began in his first term, but his recent skepticism about a potential Google breakup highlights the power he will hold over how those cases are run. ""If you do that, are you going to destro…",The Times of India,https://economictimes.indiatimes.com/tech/technology/donald-trump-expected-to-shift-course-on-antitrust-stop-google-breakup/articleshow/115021743.cms,06-11-2024 13:34,trump expected continue case big tech several began first term recent skepticism potential google breakup highlight power hold case run going destro
New Evidence Resurfaces In 50-Year-Old Case Of Teenage Sisters Who Vanished After Going For Pizza,"Lloyd Lee Welch Jr., a man with a violent criminal history, was convicted of abducting and murdering the girls.
The post New Evidence Resurfaces In 50-Year-Old Case Of Teenage Sisters Who Vanished After Going For Pizza first appeared on Bored Panda.",Boredpanda.com,https://www.boredpanda.com/police-uncover-new-evidence-lyon-sisters-disappearance-50-years-ago/,06-11-2024 13:32,lloyd lee welch jr man violent criminal history convicted abducting murdering girl post new evidence resurfaces yearold case teenage sister vanished going pizza first appeared bored panda
White House Legalizes All Gain-Of-Function Research to Build More BIOWEAPONS,"The regime of Joe Biden and Kamala Harris has revealed that formerly illegal gain-of-function research is now fully legal, meaning the bioweapons industry is free to start churning out more plagues like the Wuhan coronavirus (COVID-19).",Shtfplan.com,https://www.shtfplan.com/headline-news/white-house-legalizes-all-gain-of-function-research-to-build-more-bioweapons,06-11-2024 13:30,regime joe biden kamala harris revealed formerly illegal gainoffunction research fully legal meaning bioweapon industry free start churning plague like wuhan coronavirus covid
"Trump expected to shift course on antitrust, stop Google breakup","Donald Trump will likely dial back some of the antitrust policies pursued under the administration of President Joe Biden, potentially including a bid to break up Alphabet's Google over its dominance in online search, experts said.Trump is expected to continu…",CNA,https://www.channelnewsasia.com/business/trump-expected-shift-course-antitrust-stop-google-breakup-4730571,06-11-2024 13:29,donald trump likely dial back antitrust policy pursued administration president joe biden potentially including bid break alphabet google dominance online search expert saidtrump expected continu
Maximize Your Marketing Budget: Digital Strategies That Lower Lead Costs for High-Value Excavation Projects,Looking to reduce lead costs for high-value excavation projects? Discover digital marketing strategies that maximize your budget and help attract premium clients.,Excavationmarketingpros.com,https://excavationmarketingpros.com/blog/b/maximize-your-marketing-budget-digital-strategies-that-lower-lead-costs-for-high-value-excavation-projects,06-11-2024 13:29,looking reduce lead cost highvalue excavation project discover digital marketing strategy maximize budget help attract premium client
Score a 32-inch 4K 240Hz Odyssey OLED G8 monitor and FREE Odyssey G3 with Samsung’s early Black Friday sale,"As a part of its early Black Friday sale with deals on a bunch of its Odyssey models, Samsung is offering its new Odyssey OLED G8 4K UHD 240Hz gaming monitor down at $999.99 shipped. This is a fairly new unit that debuted earlier this year in June carrying a …",9to5Toys,http://9to5toys.com/2024/11/06/samsung-early-black-friday-sale-odyssey-oled-g8-monitor/,06-11-2024 13:28,part early black friday sale deal bunch odyssey model samsung offering new odyssey oled g k uhd hz gaming monitor shipped fairly new unit debuted earlier year june carrying
Sara Sharif's father claims 'crazy' wife abused him at home,"Sara Sharif's father has told a court he did not beat the 10-year-old girl, claiming his wife was ""very, very, crazy"" and accusing her of abuse.",Sky.com,https://news.sky.com/story/sara-sharifs-father-claims-crazy-wife-abused-him-at-home-as-he-denies-beating-daughter-13249415,06-11-2024 13:27,sara sharifs father told court beat yearold girl claiming wife crazy accusing abuse
Here Is The Smartest Black Friday Offer: This AI Tool Is 82% Off To Empower Your Future,"1minAI is an AI tool that everyone should consider, whether you're a newcomer or an AI expert.",Gizmodo.com,https://gizmodo.com/here-is-the-smartest-black-friday-offer-this-ai-tool-is-82-off-to-empower-your-future-2000521062,06-11-2024 13:25,minai ai tool everyone consider whether youre newcomer ai expert
"YouTube Launches ‘Data Stories’ For First-Day Video Metrics via @sejournal, @MattGSouthern","YouTube rolls out new analytics tools to help creators better understand video performance.
The post YouTube Launches ‘Data Stories’ For First-Day Video Metrics appeared first on Search Engine Journal.",Search Engine Journal,https://www.searchenginejournal.com/youtube-launches-data-stories-for-first-day-video-metrics/531902/,06-11-2024 13:24,youtube roll new analytics tool help creator better understand video performance post youtube launch data story firstday video metric appeared first search engine journal
Was the 2024 Election Too Big to Rig?,"No matter the outcome, pervasive bias by the mainstream media and other platforms favored Harris over Trump, effectively rigging the 2024 election in a way that erodes public faith in fair elections. t’s Wednesday, the 6th of November, and America has chosen …",Freerepublic.com,https://freerepublic.com/focus/f-chat/4276164/posts,06-11-2024 13:20,matter outcome pervasive bias mainstream medium platform favored harris trump effectively rigging election way erodes public faith fair election t wednesday th november america chosen
Chef says he used ChatGPT to prepare sexual harassment claim,WRC hears colleague thrust into him ‘as if he was riding a horse’,The Irish Times,https://www.irishtimes.com/business/2024/11/06/chef-says-he-used-chatgpt-to-prepare-sexual-harassment-claim/,06-11-2024 13:19,wrc hears colleague thrust riding horse
Apple’s Employee Count Grew During 2024 Despite Multiple Rounds of Layoffs,"Apple reports that its employee pool grew during 2024, despite the company conducting four rounds of small-scale layoffs during the year.Read More...",Mactrast.com,https://www.mactrast.com/2024/11/apples-employee-count-grew-during-2024-despite-multiple-rounds-of-layoffs/,06-11-2024 13:19,apple report employee pool grew despite company conducting four round smallscale layoff yearread
"Journey 2024 Black Friday sale now live: 50% off iPhone cases, 30% off Apple Watch bands, more from $15","The official Journey Black Friday sale is now live with up to 50% in savings on a range of the brand’s tech accessories. This includes everything from its desk mats with built-in MagSafe charging right through to its MagSafe wallets, 3-in-1 charging stands, t…",9to5Toys,http://9to5toys.com/2024/11/06/journey-2024-black-friday-sale-now-live/,06-11-2024 13:18,official journey black friday sale live saving range brand tech accessory includes everything desk mat builtin magsafe charging right magsafe wallet charging stand
'No energy for a battle': SF bakery removes 7% surcharge amid online backlash,"This week, San Francisco's popular Jane the Bakery removed a 7% surcharge used to pay for employee health care amid backlash online.",SFGate,https://www.sfgate.com/food/article/sf-bakery-removes-surcharge-amid-online-backlash-19890319.php,06-11-2024 13:15,week san franciscos popular jane bakery removed surcharge used pay employee health care amid backlash online
The Next Nintendo Console Will Be Backwards Compatible With Switch,"In a new message on social media, Nintendo confirmed that its upcoming console will be backward compatible with the Nintendo Switch. The word came down on the company's own corporate Twitter/X account, in a brief statement released in both Japanese and Englis…",Bleeding Cool News,https://bleedingcool.com/games/the-next-nintendo-console-will-be-backwards-compatible-with-switch/,06-11-2024 13:12,new message social medium nintendo confirmed upcoming console backward compatible nintendo switch word came company corporate twitterx account brief statement released japanese englis
"If AI is your brand’s next battleground, here’s how to win","Search engine optimization (SEO) just got more difficult, but where there’s change, there’s opportunity. Comms strategist Aiden Muller talks us through how AI may throw a spanner into the works for brands. Generative AI is fast being integrated into search (G…",The Drum,https://www.thedrum.com/opinion/2024/11/06/if-ai-your-brand-s-next-battleground-here-s-how-win,06-11-2024 13:10,search engine optimization seo got difficult there change there opportunity comms strategist aiden muller talk u ai may throw spanner work brand generative ai fast integrated search g
Android 16 release date suggests faster rollout than past versions,Android 16 is scheduled to transition to the Android Open Source Project (AOSP) on June 3.,Mashable,https://me.mashable.com/tech/48671/android-16-release-date-suggests-faster-rollout-than-past-versions,06-11-2024 13:03,android scheduled transition android open source project aosp june
How Large Firms Can Get Innovation Right,"The key is to have three different kinds of leaders working together flexibly, but within a set of prescribed rules.",Harvard Business Review,https://hbr.org/podcast/2024/11/how-large-firms-can-get-innovation-right,06-11-2024 13:02,key three different kind leader working together flexibly within set prescribed rule
"Streamin, Openvibe, Political Advertising, More: Wednesday ResearchBuzz, November 6, 2024","NEW RESOURCES Found on Calishat Snaps: Streamin, a search engine for streaming media content. From the front page: “Streamin is your ultimate streaming guide, designed to help you discover where to watch […]",Researchbuzz.me,https://researchbuzz.me/2024/11/06/streamin-openvibe-political-advertising-more-wednesday-researchbuzz-november-6-2024/,06-11-2024 13:01,new resource found calishat snap streamin search engine streaming medium content front page streamin ultimate streaming guide designed help discover watch
"Full-service direct flights from London to Xi’an (Terracotta Army), China from £356","Tianjin Airlines are offering discounted fares from London, UK, to Xi’an, China! Tickets available for £356 for a round trip.",Fly4free.com,https://www.fly4free.com/flight-deals/europe/flights-from-london-to-xian-p356/,06-11-2024 13:00,tianjin airline offering discounted fare london uk xian china ticket available round trip
Take Your Best Night-Mode Photos on Your Phone With These Pro Tips,You can take amazing images at night using just your iPhone or Android phone. Try these tips from a professional photographer.,CNET,https://www.cnet.com/tech/mobile/take-your-best-night-mode-photos-on-your-phone-with-these-pro-tips/,06-11-2024 13:00,take amazing image night using iphone android phone try tip professional photographer
What the Galaxy S25 Needs to Be the Android Phone to Beat in 2025,"Commentary: Faster charging, more practical AI features and a leap forward in camera technology would make Samsung's next flagship a force to reckon with.",CNET,https://www.cnet.com/tech/mobile/what-the-galaxy-s25-needs-to-be-the-android-phone-to-beat-in-2025/,06-11-2024 13:00,commentary faster charging practical ai feature leap forward camera technology would make samsungs next flagship force reckon
Using SingleStore and WebAssembly for Sentiment Analysis of Stack Overflow Comments,"In this article, we'll see how to use SingleStore and WebAssembly to perform sentiment analysis of Stack Overflow comments. We'll use some existing WebAssembly code that has already been prepared and hosted in a cloud environment.
The notebook file used in th…",Medium,https://medium.com/@VeryFatBoy/quick-tip-using-singlestore-and-webassembly-for-sentiment-analysis-of-stack-overflow-comments-421102650b0f,06-11-2024 13:00,article well see use singlestore webassembly perform sentiment analysis stack overflow comment well use existing webassembly code already prepared hosted cloud environment notebook file used th
Why a Recipe Plugin is the Secret Ingredient for Your Food Blog’s Success,"A recipe plugin is crucial for food blogs, enhancing site SEO, boosting reader experience, and adding structured data for search engines like Google.",Wordpress.com,http://wordpress.com/blog/2024/11/06/recipe-plugins/,06-11-2024 13:00,recipe plugin crucial food blog enhancing site seo boosting reader experience adding structured data search engine like google
Best Home Security Systems You Can Pack Up and Take With You,"If you're moving to a new home or frequently change addresses, we've got the top 5 security systems that can you can take along.",CNET,https://www.cnet.com/home/security/home-security-systems-you-can-pack-up-and-take-with-you/,06-11-2024 13:00,youre moving new home frequently change address weve got top security system take along
2025 Tesla Model 3 v Volvo EX30 electric car comparison,The Volvo EX30 is the smallest EV to wear the badge. Is it a better city-friendly EV than a Tesla Model 3?,Drive.com.au,https://www.drive.com.au/reviews/2024-tesla-model-3-vs-volvo-ex30-comparison/,06-11-2024 13:00,volvo ex smallest ev wear badge better cityfriendly ev tesla model
