Title,Description,Publisher,Link,Published Time,processed_text
How To Use Video Content To Grow Your Business,"By strategically incorporating video into your marketing plan, you can engage your audience, increase your online visibility and drive more sales.",Forbes,https://www.forbes.com/councils/forbesbusinesscouncil/2024/11/06/how-to-use-video-content-to-grow-your-business/,06-11-2024 15:00,strategically incorporating video marketing plan engage audience increase online visibility drive sale
How to make Windows search use Google instead of Bing,"The Windows search function is very practical because it usually finds installed programs faster than using the program menu. However, you can also use the input field to search the internet. By default, Windows uses the Microsoft search engine Bing for this.…",PCWorld,https://www.pcworld.com/article/2509630/how-the-windows-search-uses-google-instead-of-bing.html,06-11-2024 15:00,window search function practical usually find installed program faster using program menu however also use input field search internet default window us microsoft search engine bing
How To Get the Most out of Claude AI,"Want to work smarter, not harder? Add Claude AI to your toolkit and let it do the heavy lifting for your business, from data analysis to content creation.
The post How To Get the Most out of Claude AI appeared first on DreamHost Blog.",Dreamhost.com,https://www.dreamhost.com/blog/claude-ai/,06-11-2024 15:00,want work smarter harder add claude ai toolkit let heavy lifting business data analysis content creation post get claude ai appeared first dreamhost blog
"Chrome Stable Channel Update for Desktop (Google, 2024.11.05)","Chrome 130.0.6723.116/.117 (Windows / Mac) 130.0.6723.116 (Linux) 2 篁吟祉ュャ」篆③c∫#:


<ul> <li> Chrome for Android Update (Google, 2024.11.05) Chrome 130 (130.0.6723.102) for Android 
 </li></ul>",Ryukoku.ac.jp,http://www.st.ryukoku.ac.jp/~kjm/security/memo/2024/11.html#20241107_chrome,06-11-2024 15:00,chrome window mac linux c ul li chrome android update google chrome android liul
D&AD recognises influencers and creators in new awards category for 2025,"The iconic awards organisation just announced three new awards categories for next year's competition.

Known throughout the industry, D&AD (short for Design and Art Direction) has been promoti...",Creative Boom,https://www.creativeboom.com/news/dad-design-award-introduce-a-new-creator-category-for-2025/,06-11-2024 15:00,iconic award organisation announced three new award category next year competition known throughout industry dad short design art direction promoti
#144 – Damon Cook & Seth Rubenstein on the Transformational Interactivity API,"On the podcast today we have Damon Cook and Seth Rubenstein, and we're here to talk about the Interactivity API. We explore its benefits for building seamless interactive websites, how it enhances both the front-end user experience and backend editorial proce…",Wptavern.com,https://wptavern.com/podcast/144-damon-cook-seth-rubenstein-on-the-transformational-interactivity-api,06-11-2024 15:00,podcast today damon cook seth rubenstein talk interactivity api explore benefit building seamless interactive website enhances frontend user experience backend editorial proce
"Today’s iOS price drops and freebies: ICEY, Basketball Club Story, Quest Islands, more","Today’s mid-week collection of the best app and game deals is now ready and waiting below. Joining today’s App Store deals, as well as the ongoing cash discounts on the new M4 Mac mini and M4 iMac, this morning ushered in the first straight up deals on the ne…",9to5Toys,http://9to5toys.com/2024/11/06/todays-ios-price-drops-freebies-icey/,06-11-2024 14:57,today midweek collection best app game deal ready waiting joining today app store deal well ongoing cash discount new mac mini imac morning ushered first straight deal ne
A Secret Something Is Killing The Children Comic is Coming From Boom,"The comics industry can't get enough of James Tynion and Werther Dell'edera's mega-hit Something is Killing the Children. Boom Studios can't seem to get enough either, as they are finding new ways every year to reprint and resell issue #1. It should come as n…",Bleeding Cool News,https://bleedingcool.com/comics/secret-something-is-killing-the-children-comic-boom/,06-11-2024 14:57,comic industry cant get enough james tynion werther dellederas megahit something killing child boom studio cant seem get enough either finding new way every year reprint resell issue come n
Trump resistance begins with over 100 progressive groups gathering Thursday,"In November 2016, many liberals were surprised by Donald Trump’s resounding Electoral College victory over Hilary Clinton. They scrambled to respond, with spontaneous efforts popping up in places like Facebook, and on shared Google docs. This time, the left h…",Biztoc.com,https://biztoc.com/x/624e194a1bc31f9b,06-11-2024 14:56,november many liberal surprised donald trump resounding electoral college victory hilary clinton scrambled respond spontaneous effort popping place like facebook shared google doc time left h
Lumen turns to Google for AI smarts,US network operator adopts Google Cloud AIOpsThe partnership aims to increase Lumen’s operational efficiencies by quickly resolving issues on its network befor…,TelecomTV,https://www.telecomtv.com/content/telcos-and-ai-channel/lumen-turns-to-google-for-ai-smarts-51702/,06-11-2024 14:54,u network operator adopts google cloud aiopsthe partnership aim increase lumen operational efficiency quickly resolving issue network befor
All Google Cloud users will have to enable MFA by 2025,"Google has announced that, by the end of 2025, multi-factor authentication (MFA) – aka 2-step verification – will become mandatory for all Google Cloud accounts. “Given the sensitive nature of cloud deployments — and with phishing and stolen credentials remai…",Help Net Security,https://www.helpnetsecurity.com/2024/11/06/google-cloud-mfa/,06-11-2024 14:52,google announced end multifactor authentication mfa aka step verification become mandatory google cloud account given sensitive nature cloud deployment phishing stolen credential remai
pelican-pybtex 1.0.0b0,Manage your academic publications page with Pelican and pybtex (BibTeX),Pypi.org,https://pypi.org/project/pelican-pybtex/,06-11-2024 14:52,manage academic publication page pelican pybtex bibtex
Donkey Kong Revs His Engine for Upcoming LEGO Mario Kart Set,"Get ready for a heavy hitter as LEGO is bringing another popular franchise to their brick world with Mario Kart. This popular racing game series was developed by Nintendo and featured characters from all over the Super Mario franchise, including Mario, Luigi,…",Bleeding Cool News,https://bleedingcool.com/collectibles/donkey-kong-revs-his-engine-for-upcoming-lego-mario-kart-set/,06-11-2024 14:52,get ready heavy hitter lego bringing another popular franchise brick world mario kart popular racing game series developed nintendo featured character super mario franchise including mario luigi
Open AI Systems Lag Behind Proprietary and Closed Models,Big players are looking at the pros and cons of releasing things like model weights in a race between “open” and “closed” models.,Forbes,https://www.forbes.com/sites/johnwerner/2024/11/06/open-ai-systems-lag-behind-proprietary-and-closed-models/,06-11-2024 14:50,big player looking pro con releasing thing like model weight race open closed model
"In a letter to a UK parliamentary committee, the FT says news organizations are forced to accept Google's AI crawlers due Googlebot's presence on most websites (Charlotte Tobitt/Press Gazette)","Charlotte Tobitt / Press Gazette:
In a letter to a UK parliamentary committee, the FT says news organizations are forced to accept Google's AI crawlers due Googlebot's presence on most websites  —  News organisations don't have a “genuine choice” about whethe…",Mediagazer.com,https://mediagazer.com/241106/p5,06-11-2024 14:50,charlotte tobitt press gazette letter uk parliamentary committee ft say news organization forced accept google ai crawler due googlebots presence website news organisation dont genuine choice whethe
"Google Has No Duty To Refund Gift Card Scam Victims, Judge Finds","A federal judge in California has dismissed most claims in a class-action lawsuit against Google over its handling of gift card scams, ruling the tech giant is not liable for millions in consumer losses. U.S. District Judge Beth Freeman found Google bears no …",Slashdot.org,https://tech.slashdot.org/story/24/11/06/1445223/google-has-no-duty-to-refund-gift-card-scam-victims-judge-finds,06-11-2024 14:45,federal judge california dismissed claim classaction lawsuit google handling gift card scam ruling tech giant liable million consumer loss u district judge beth freeman found google bear
The obvious reason why I'm not sold on smartphone AI features yet (and I'm not alone),"Manufacturers are betting on AI to be the future of phones. That might be the case, but is that what consumers want or need?",ZDNet,https://www.zdnet.com/article/the-obvious-reason-why-im-not-sold-on-smartphone-ai-features-yet-and-im-not-alone/,06-11-2024 14:43,manufacturer betting ai future phone might case consumer want need
"Trump 2.0 will have a massive impact on Big Tech, AI, chips and more—in Silicon Valley and beyond","Predicting Trump remains difficult as ever, but there are clues to what the President-elect might do.",Fortune,https://fortune.com/2024/11/06/trump-2-0-will-have-a-massive-impact-on-big-tech-ai-chips-and-more-in-silicon-valley-and-beyond/,06-11-2024 14:38,predicting trump remains difficult ever clue presidentelect might
Bendable titanium graces this MagSafe car mount from Baseus at $13 Prime shipped (Save 50%),"Baseus MagSafe Bendable Titanium Car Mount



Buy for $13 (Reg. $26)



Clip the on-page 50% off coupon














What we love




Just when we thought we had seen just about all the types of MagSafe car mounts on the market, this unique design caught …",9to5Toys,http://9to5toys.com/2024/11/06/baseus-magsafe-bendable-titanium-car-mount/,06-11-2024 14:37,baseus magsafe bendable titanium car mount buy reg clip onpage coupon love thought seen type magsafe car mount market unique design caught
12 Best SaaS Marketing Strategies for Business Growth,Check out the top marketing strategies to drive growth for your SaaS business in 2024.,Semrush.com,https://www.semrush.com/blog/saas-marketing-strategies/,06-11-2024 14:36,check top marketing strategy drive growth saas business
21 Advertising Metrics to Help You Measure Your Performance,"Master the art of ad tracking with these key metrics that reveal the true impact of your campaigns. Discover how conversions, CTR, ROAS, and other KPIs drive your advertising success.",Semrush.com,https://www.semrush.com/blog/advertising-metrics/,06-11-2024 14:35,master art ad tracking key metric reveal true impact campaign discover conversion ctr roas kpis drive advertising success
Looking for new activities? Google wants you to turn to its navigation app,"Queenie Wong | (TNS) Los Angeles Times
Search giant Google wants people to use its navigation app for more than just finding directions and avoiding traffic.
The tech giant is adding generative AI features to Google Maps so people can easily get recommendatio…",Biztoc.com,https://biztoc.com/x/af0146c851c33a33,06-11-2024 14:34,queenie wong tn los angeles time search giant google want people use navigation app finding direction avoiding traffic tech giant adding generative ai feature google map people easily get recommendatio
"Rare all-time low price now live on Silent Hill 2 remake for PS5, Final Fantasy I-VI Collection, more",Woot has now updated its ongoing console game sale with the best deal we have tracked yet on Silent Hill 2 for PS5. The regularly $70 title has now dropped down to $59.99 with free shipping for Prime members (a $6 delivery fee will apply otherwise). Still up …,9to5Toys,http://9to5toys.com/2024/11/06/all-time-low-price-silent-hill-2-remake/,06-11-2024 14:31,woot updated ongoing console game sale best deal tracked yet silent hill p regularly title dropped free shipping prime member delivery fee apply otherwise still
Docs in Proton Drive Gets a New Suggesting Mode,"Proton announced a new Suggesting mode for Docs in Proton Drive that lets you track changes made by others. 
The post Docs in Proton Drive Gets a New Suggesting Mode appeared first on Thurrott.com.",Thurrott.com,https://www.thurrott.com/cloud/312714/docs-in-proton-drive-gets-a-new-suggesting-mode,06-11-2024 14:31,proton announced new suggesting mode doc proton drive let track change made others post doc proton drive get new suggesting mode appeared first thurrottcom
Spruce up your porch or patio with Govee’s 48-foot smart outdoor-ready string light set at $27 (Save 27%),"Govee 48-foot Smart Warm White Outdoor String Lights



Buy for $27 (Reg. $37)



Clip the on-page $10 off coupon














What we love




Give your outdoor space a bit of ambiance with this string light set from Govee. It ready to withstand the elem…",9to5Toys,http://9to5toys.com/2024/11/06/govee-48-foot-smart-outdoor-string-lights/,06-11-2024 14:31,govee foot smart warm white outdoor string light buy reg clip onpage coupon love give outdoor space bit ambiance string light set govee ready withstand elem
App store optimization: A guide to enhance your app’s visibility,"App store optimization (ASO) helps your app stand out in busy marketplaces. It’s about making your app more visible and increasing downloads. This guide will provide strategies for both Google Play and Apple App Store, perfect for those starting or looking to…",Yoast.com,https://yoast.com/app-store-optimization/,06-11-2024 14:31,app store optimization aso help app stand busy marketplace making app visible increasing downloads guide provide strategy google play apple app store perfect starting looking
Wallpaper Wednesday: More great phone wallpapers for all to share (November 6),"Looking for some new Android wallpapers? Here's the Android Authority Wallpaper Wednesday roundup for November 6, 2024.",Android Authority,https://www.androidauthority.com/wallpaper-wednesday-nov-06-2024-3496550/,06-11-2024 14:30,looking new android wallpaper here android authority wallpaper wednesday roundup november
Looking for new activities? Google wants you to turn to its navigation app,The tech giant is adding generative AI features to Google Maps so people can easily get recommendations for places to go and activities to do.,Boston Herald,https://www.bostonherald.com/2024/11/06/google-maps-new-activities/,06-11-2024 14:25,tech giant adding generative ai feature google map people easily get recommendation place go activity
Sony 65-Inch Bravia 9 QLED TV (K-65XR90),"A bright, feature-packed QLED TV
Sony’s Bravia 9 is a beautiful flagship QLED TV with a panel that rivals comparable Hisense and TCL models in brightness, and a sleek design that includes its own spatial audio sound system with height channels. It’s a fantast…",PCMag.com,https://uk.pcmag.com/tvs/155203/sony-65-inch-bravia-9-qled-tv-k-65xr90,06-11-2024 14:23,bright featurepacked qled tv sonys bravia beautiful flagship qled tv panel rival comparable hisense tcl model brightness sleek design includes spatial audio sound system height channel fantast
Sony 65-Inch Bravia 9 QLED TV (K-65XR90),"A bright, feature-packed QLED TV
Sony’s Bravia 9 is a beautiful flagship QLED TV with a panel that rivals comparable Hisense and TCL models in brightness, and a sleek design that includes its own spatial audio sound system with height channels. It’s a fantast…",PCMag.com,https://me.pcmag.com/en/tvs/26747/sony-65-inch-bravia-9-qled-tv-k-65xr90,06-11-2024 14:23,bright featurepacked qled tv sonys bravia beautiful flagship qled tv panel rival comparable hisense tcl model brightness sleek design includes spatial audio sound system height channel fantast
"Trump Wins, ""Move To Canada"" Searches Spike, Liberals Meltdown Online","Trump Wins, ""Move To Canada"" Searches Spike, Liberals Meltdown Online
 
Google searches for ""Move to Canada"" surged overnight, almost in parallel with Trump's rising election odds, as the historic election swung key battleground states in his favor. Internet …",Biztoc.com,https://biztoc.com/x/0e30440e467ad811,06-11-2024 14:23,trump win move canada search spike liberal meltdown online google search move canada surged overnight almost parallel trump rising election odds historic election swung key battleground state favor internet
"Trump's Big Tech Policies: What GOP Victory Means For Apple, Google, Microsoft","Donald Trump has been elected as the 47th president of the United States, defeating his Democratic opponent Kamala Harris. Here’s a look at where Trump stands on issues surrounding the technology sector and some of the biggest companies on Wall Street.
Tariff…",Biztoc.com,https://biztoc.com/x/9f44a07ba66099fa,06-11-2024 14:23,donald trump elected th president united state defeating democratic opponent kamala harris here look trump stand issue surrounding technology sector biggest company wall street tariff
Baby Mario and Luigi Hit the Finish Line with LEGO Mario Kart,"LEGO is returning to the world of Nintendo as they unveil a brand new set of sets from the world of Mario Kart. That is right, a new franchise is entering the brickdom, joining the ranks of Donkey Kong County and Super Mario Bros. Mario Kart is a beloved raci…",Bleeding Cool News,https://bleedingcool.com/collectibles/baby-mario-and-luigi-hit-the-finish-line-with-lego-mario-kart/,06-11-2024 14:22,lego returning world nintendo unveil brand new set set world mario kart right new franchise entering brickdom joining rank donkey kong county super mario bros mario kart beloved raci
Stranger Things 5 Episode Titles Released; Episode 2 Title Redacted?,"If there was ever a better day for some distractions from just how much the real world sucks, today would be that day. Today is also ""Stranger Things Day,"" which means Matt Duffer and Ross Duffer are doing their part to offer some relief and celebrate the day…",Bleeding Cool News,https://bleedingcool.com/tv/stranger-things-5-episode-titles-released-episode-2-title-redacted/,06-11-2024 14:20,ever better day distraction much real world suck today would day today also stranger thing day mean matt duffer ross duffer part offer relief celebrate day
Well-rated 4* aparthotel in Berlin for €60/double,Excellent hotel deal! If you plan to visit Berlin book a studio or apartment at 4* Mondrian Suites Berlin Checkpoint Charlie for only €60/night (based on 2 people sharing).,Fly4free.com,https://www.fly4free.com/flight-deals/europe/4-star-aparthotel-in-berlin/,06-11-2024 14:20,excellent hotel deal plan visit berlin book studio apartment mondrian suite berlin checkpoint charlie night based people sharing
"Sperry’s Sale on Sale Event takes an extra 30% off boat shoes, boots, sneakers, more from $21","The Sperry Sale on Sale Event takes an extra 30% off clearance styles. Discount is applied at checkout. Inside this sale you can find deals on boat shoes, boots, sneakers, loafers, and more. Customers receive free delivery on orders of $50 or more. A standout…",9to5Toys,http://9to5toys.com/2024/11/06/sperry-sale-on-sale-event/,06-11-2024 14:16,sperry sale sale event take extra clearance style discount applied checkout inside sale find deal boat shoe boot sneaker loafer customer receive free delivery order standout
Why the AI-ification of workplaces may move slower than we think,"For the last 1.5 years since ChatGPT launched, workers and business leaders have been singing two different tunes about the advent of generative artificial intelligence. From the C-suites, there is excitement and optimism about cost savings and improved produ…",Drata.com,https://drata.com/blog/why-the-ai-ification-of-workplaces-may-move-slower-than-we-think,06-11-2024 14:15,last year since chatgpt launched worker business leader singing two different tune advent generative artificial intelligence csuites excitement optimism cost saving improved produ
"Random: ""I'm A Pretty Normal Person"" - Miyamoto Disputes 'Genius' Label","Just normal, innocent men.Nintendo has released its Q&A transcription for the recent financial briefing, and it contains a rather humorous interaction between an investor and legendary creator Shigeru Miyamoto in which the former calls Miyamoto a ""genius"". To…",Nintendo Life,https://www.nintendolife.com/news/2024/11/random-im-a-pretty-normal-person-miyamoto-disputes-genius-label,06-11-2024 14:15,normal innocent mennintendo released qa transcription recent financial briefing contains rather humorous interaction investor legendary creator shigeru miyamoto former call miyamoto genius
"""Narco sub"" carrying 8,000 pounds of cocaine intercepted in Pacific Ocean, Mexican Navy says - CBS News","""Narco sub"" carrying 8,000 pounds of cocaine intercepted in Pacific Ocean, Mexican Navy saysCBS News View Full Coverage on Google News ...",Slashdot.org,https://slashdot.org/firehose.pl?op=view&amp;id=175416947,06-11-2024 14:12,narco sub carrying pound cocaine intercepted pacific ocean mexican navy sayscbs news view full coverage google news
Cozy Shopkeeping Game Trash Goblin Launches in Early Access,"Indie game developer and publisher Spilt Milk Studios have officially released their latest game, Trash Goblin, into Early Access on Steam. The game has you playing as an actual goblin running a small shop in a market where you work with antiques to uncover p…",Bleeding Cool News,https://bleedingcool.com/games/cozy-shopkeeping-game-trash-goblin-launches-in-early-access/,06-11-2024 14:12,indie game developer publisher spilt milk studio officially released latest game trash goblin early access steam game playing actual goblin running small shop market work antique uncover p
"Built-in USB-C cable headlines Baseus’ 10K 30W MagSafe power bank, now $27.50 (Save 40%)","Baseus 10,000mAh 30W MagSafe Power Bank with built-in USB-C cable



Buy for $27.50 (Reg. $46)



Clip the on-page 40% off coupon














What we love




Close in on iPhone 16’s 45W charging speeds with this versatile power bank from Baseus. Not onl…",9to5Toys,http://9to5toys.com/2024/11/06/1090417baseus-10000mah-30w-magsafe-power-bank-built-in-cable/,06-11-2024 14:10,baseus mah w magsafe power bank builtin usbc cable buy reg clip onpage coupon love close iphone w charging speed versatile power bank baseus onl
"ASUS Zenbook S 16 OLED Copilot+ PC with AMD Ryzen AI 9 365 falls to a new low at $1,150 ($250 off)","We are now tracking a deal at Best Buy that drops ASUS’ Zenbook S 16 OLED Copilot+ PC to $1,149.99 shipped. This particular laptop with the latest Ryzen AI 9 365 Strix Point APU hit the scene earlier this year in June carrying a $1,400 price tag. It saw its f…",9to5Toys,http://9to5toys.com/2024/11/06/asus-zenbook-s-16-oled-copilot-pc-new-low/,06-11-2024 14:07,tracking deal best buy drop asus zenbook oled copilot pc shipped particular laptop latest ryzen ai strix point apu hit scene earlier year june carrying price tag saw f
Opinion: Google’s Greed Is Undermining Alphabet’s Growth,"The explosive growth Google Cloud enjoys is masking Alphabet‘s (NASDAQ:GOOG)(NASDAQ:GOOGL) problems with Google Search and at YouTube. Because of the company’s insatiable appetite for revenue, it is abusing its market power, which will undermine the strong fo…",Biztoc.com,https://biztoc.com/x/fb90ff2f1a36c0de,06-11-2024 14:01,explosive growth google cloud enjoys masking alphabet nasdaqgoognasdaqgoogl problem google search youtube company insatiable appetite revenue abusing market power undermine strong fo
I tested Google’s fancy image generator and quickly found its limits,"Google's Imagen 3 is an impressive tool overall, but it has several limits in place you have to be aware of.",Android Authority,https://www.androidauthority.com/imagen-3-limits-3496806/,06-11-2024 14:00,google imagen impressive tool overall several limit place aware
Kloudfuse Adds Raft of Additional Capabilities to Unify Observability,Kloudfuse today updated its namesake observability platform to add support for continuous profiling and real user monitoring (RUM) along with additional analytics and artificial intelligence (AI) capabilities.,DevOps.com,https://devops.com/?p=174053,06-11-2024 14:00,kloudfuse today updated namesake observability platform add support continuous profiling real user monitoring rum along additional analytics artificial intelligence ai capability
How I Use Google Home's Smartphone Widget to Easily Control My Smart Home,Here's how I activated Google Home's smartphone widget and how you can too!,MakeUseOf,https://www.makeuseof.com/how-to-use-google-home-widget-smart-home/,06-11-2024 14:00,here activated google home smartphone widget
"As Nvidia flips Apple at $3.43T, AI coins follow suit with big gains!","Nvidia has surged to surpass Apple as the most valuable company in the world, hitting $3.43 trillion in market cap.",Ambcrypto.com,https://ambcrypto.com/as-nvidia-flips-apple-at-3-43t-ai-coins-follow-suit-with-big-gains/,06-11-2024 14:00,nvidia surged surpass apple valuable company world hitting trillion market cap
Want to improve rankings and traffic? Stop blindly following SEO tool recommendations,"Learn why SEO tools shouldn’t be blindly trusted and five best practices for smarter, data-driven optimizations.",Search Engine Land,https://searchengineland.com/improve-rankings-traffic-seo-tool-recommendations-447983,06-11-2024 14:00,learn seo tool shouldnt blindly trusted five best practice smarter datadriven optimization
