Title,Description,Publisher,Link,Published Time,processed_text
"Cloud services sector surges, fuelled by AI",The already massive cloud infrastructure services sector is not just growing – it’s growing at an increasingly rapid paceThe sector was worth almost $84bn duri…,TelecomTV,https://www.telecomtv.com/content/digital-platforms-services/cloud-services-sector-surges-fuelled-by-ai-51700/,06-11-2024 12:56,already massive cloud infrastructure service sector growing growing increasingly rapid pacethe sector worth almost bn duri
Bixby just got a whole lot smarter thanks to AI,"Samsung has announced a new and upgraded version of its Bixby digital assistant, where thanks to AI, it has gotten smarter.
The post Bixby just got a whole lot smarter thanks to AI appeared first on Phandroid.",Phandroid - News for Android,https://phandroid.com/2024/11/06/bixby-just-got-a-whole-lot-smarter-thanks-to-ai/,06-11-2024 12:55,samsung announced new upgraded version bixby digital assistant thanks ai gotten smarter post bixby got whole lot smarter thanks ai appeared first phandroid
"What's next for tech giants like Google, Apple, and Microsoft now that Trump has won","The tech sector is bracing itself for change under a second Donald Trump presidency.
- AI regulation is likely to change under Trump, but major antitrust cases are unlikely to be impacted.
- From tariffs to visas, here's how Trump's presidency could affect Bi…",Biztoc.com,https://biztoc.com/x/71ad12d1f76be6b9,06-11-2024 12:55,tech sector bracing change second donald trump presidency ai regulation likely change trump major antitrust case unlikely impacted tariff visa here trump presidency could affect bi
