Title,Description,Publisher,Link,Published Time,processed_text
How to integrate your SEO and paid search strategies to maximize efficiency and reduce CAC,"Ways to combine the respective powers of SEO and PPC to reduce customer acquisition costs (CAC)
The post How to integrate your SEO and paid search strategies to maximize efficiency and reduce CAC first appeared on PPC Hero.",Ppchero.com,http://www.ppchero.com/how-to-integrate-your-seo-and-paid-search-strategies-to-maximize-efficiency-and-reduce-cac/,06-11-2024 15:07,way combine respective power seo ppc reduce customer acquisition cost cac post integrate seo paid search strategy maximize efficiency reduce cac first appeared ppc hero
"As Nvidia flips Apple at $3.43T, AI coins follow suit with big gains!","Nvidia has surged to surpass Apple as the most valuable company in the world, hitting $3.43 trillion in market cap.",Ambcrypto.com,https://ambcrypto.com/as-nvidia-flips-apple-at-3-43t-ai-coins-follow-suit-with-big-gains/,06-11-2024 14:00,nvidia surged surpass apple valuable company world hitting trillion market cap
"How Trump’s Second Administration Affects Business: Musk, Tariffs and More","Donald Trump’s return to the White House after winning the Nov. 5 U.S. presidential election may reshape American business. Much depends on whom he appoints as deputies and cabinet members, including the role of Tesla CEO Elon Musk, and what …",Insurance Journal,https://www.insurancejournal.com/news/national/2024/11/06/800274.htm,06-11-2024 13:50,donald trump return white house winning nov u presidential election may reshape american business much depends appoints deputy cabinet member including role tesla ceo elon musk
Presentation: Beyond Million Dollar Lines of Code: Practical Strategies for Engineering Cost-Effective Cloud Systems,"Erik Peterson discusses the actions, tasks, and approaches necessary for crafting software that meets technical specifications and controls expenditure in the cloud. By Erik Peterson",InfoQ.com,https://www.infoq.com/presentations/cost-effective-cloud-systems/,06-11-2024 12:20,erik peterson discus action task approach necessary crafting software meet technical specification control expenditure cloud erik peterson
South Korea fined Meta $15.67M for illegally collecting and sharing Facebook users,"South Korea fined Meta $15.67M for illegally collecting and sharing Facebook users’ sensitive data, including political views and sexual orientation, with advertisers. South Korea’s data privacy watchdog, Personal Information Protection Commission (PIPC), fin…",Securityaffairs.com,https://securityaffairs.com/170618/digital-id/south-korea-fined-meta-15-67m.html,06-11-2024 12:00,south korea fined meta illegally collecting sharing facebook user sensitive data including political view sexual orientation advertiser south korea data privacy watchdog personal information protection commission pipc fin
What is a Sitemap in UX?,A sitemap in UX is more than just a visual representation of a website’s structure; it’s a foundational tool that helps designers and developers at enterprise-level organizations plan and optimize the user journey from the ground up. Sitemaps play a critical …,Uxpin.com,https://www.uxpin.com/studio/blog/sitemap-ux/,06-11-2024 10:45,sitemap ux visual representation website structure foundational tool help designer developer enterpriselevel organization plan optimize user journey ground sitemaps play critical
Trump’s in. Here’s what it means for Europe.,"From energy and trade to finance and defense, here’s how Donald Trump’s second presidency will impact EU policy.",POLITICO.eu,https://www.politico.eu/article/donald-trump-washington-us-elections-win-2024-kamala-harris-europe-russia/,06-11-2024 10:44,energy trade finance defense here donald trump second presidency impact eu policy
Russian stocks surge on likely Trump victory,"Russian stocks have rallied amid reports of Donald Trump’s likely reelection, market data shows Read Full Article at RT.com",RT,https://www.rt.com/business/607157-russian-stocks-trump-win/,06-11-2024 10:02,russian stock rallied amid report donald trump likely reelection market data show read full article rtcom
Achieving Healthcare Excellence: Insights from Jarvis Gray on Lean Six Sigma and Leadership,"Scroll down for how to subscribe, transcript, and more My guest for Episode #519 of the Lean Blog Interviews Podcast is Jarvis Gray, the Managing Director of The Quality Coaching Co. He offers more than 16 years of strategic planning, quality improvement, and…",Leanblog.org,https://www.leanblog.org/2024/11/achieving-healthcare-excellence-insights-from-jarvis-gray-on-lean-six-sigma-and-leadership/,06-11-2024 09:52,scroll subscribe transcript guest episode lean blog interview podcast jarvis gray managing director quality coaching co offer year strategic planning quality improvement
Synology fixed critical flaw impacting millions of DiskStation and BeePhotos NAS devices,"Synology addressed a critical vulnerability in DiskStation and BeePhotos NAS devices that could lead to remote code execution. Taiwanese vendor Synology has addressed a critical security vulnerability, tracked as CVE-2024-10443, that impacts DiskStation and B…",Securityaffairs.com,https://securityaffairs.com/170602/hacking/synology-fixed-critical-bug-in-diskstation-and-beephotos-nas.html,06-11-2024 09:09,synology addressed critical vulnerability diskstation beephotos na device could lead remote code execution taiwanese vendor synology addressed critical security vulnerability tracked cve impact diskstation b
"Bitcoin Acquisition Continues: Semler Scientific Increases Holdings To 1,058 BTC","Santa Clara-based healthcare tech company Semler Scientific (SMLR) recently disclosed that it purchased an additional 47 Bitcoin (BTC), bringing its total holdings to 1,058 BTC. Semler Scientific Continues To Increase Its BTC Holdings Semler Scientific, a Nas…",Bitcoinist,https://bitcoinist.com/bitcoin-acquisition-continues-semler-scientific-increases-holdings-to-1058-btc/,06-11-2024 09:00,santa clarabased healthcare tech company semler scientific smlr recently disclosed purchased additional bitcoin btc bringing total holding btc semler scientific continues increase btc holding semler scientific na
Here Come the AI Agents!,"Here Come the AI Agents!

jdimaggio@upcea.edu

Wed, 11/06/2024 - 03:00 AM

Anthropic last month took the lead in providing early access to basic AI agents for the masses. This is a huge leap forward from the chat bots that have dominated early generative AI.
…",Inside Higher Ed,https://www.insidehighered.com/opinion/blogs/online-trending-now/2024/11/06/here-come-ai-agents,06-11-2024 08:00,come ai agent jdimaggioupceaedu wed anthropic last month took lead providing early access basic ai agent mass huge leap forward chat bot dominated early generative ai
Republican Who Attacked Abortion Pills Lowering ‘Birth Rates For Teenaged Mothers’ Wins Reelection,"Andrew Bailey, who has repeatedly targeted providers of gender-affirming care and abortion, was appointed to the role in 2023 by Missouri’s governor.",HuffPost,https://www.huffpost.com/entry/republican-andrew-bailey-reelected-missouri_n_6722804be4b0bfa84f47e070,06-11-2024 06:19,andrew bailey repeatedly targeted provider genderaffirming care abortion appointed role missouri governor
"To Lead Well, Think Like A Creator",7 mindsets leaders can adopt from creators,Forbes,https://www.forbes.com/sites/alisacohn/2024/11/06/to-lead-well-think-like-a-creator/,06-11-2024 05:01,mindset leader adopt creator
ETMarkets PMS Talk: Identifying 'Compounding Machines': Sundaram’s strategy for high growth stocks,"It’s not just last month, the strategy has seen a good turnaround in performance in the last 6 months and in the last 6 years, it has created high single-digit alpha over the Nifty50 index.",The Times of India,https://economictimes.indiatimes.com/markets/expert-view/etmarkets-pms-talk-identifying-compounding-machines-sundarams-strategy-for-high-growth-stocks/articleshow/114972156.cms,06-11-2024 03:30,last month strategy seen good turnaround performance last month last year created high singledigit alpha nifty index
"Share Market Highlights November 6, 2024: Sensex gains 901 pts, Nifty ends near 24,500; IT stocks lead rally","Sensex, Nifty updates on November 6, 2024: Stock markets rallied more than 1 per cent on Wednesday with benchmark Sensex soaring 901 points on heavy buying in IT and pharma shares as Donald Trump is all set to win the US presidential elections. Extending its …",BusinessLine,https://www.thehindubusinessline.com/markets/share-market-highlights-6-november-2024/article68832948.ece,06-11-2024 01:12,sensex nifty update november stock market rallied per cent wednesday benchmark sensex soaring point heavy buying pharma share donald trump set win u presidential election extending
"Stock market today: Dow, S&P 500, Nasdaq rise as Wall Street braces for election results - Yahoo Finance","Stock market today: Dow, S&amp;P 500, Nasdaq rise as Wall Street braces for election resultsYahoo Finance View Full Coverage on Google News ...",Slashdot.org,https://slashdot.org/firehose.pl?op=view&amp;id=175410971,05-11-2024 22:32,stock market today dow sampp nasdaq rise wall street brace election resultsyahoo finance view full coverage google news
"ToxicPanda Android banking trojan targets Europe and LATAM, with a focus on Italy","The ToxicPanda Android malware has infected over 1,500 devices, enabling attackers to perform fraudulent banking transactions. Cleafy researchers spotted a new Android banking malware, dubbed ToxicPanda, which already infected over 1,500 Android devices. The …",Securityaffairs.com,https://securityaffairs.com/170605/malware/toxicpanda-android-malware-targets-italy.html,05-11-2024 21:25,toxicpanda android malware infected device enabling attacker perform fraudulent banking transaction cleafy researcher spotted new android banking malware dubbed toxicpanda already infected android device
How Prayas Lohalekar is transforming enterprise IT with GenAI tools,"“Gen AI is more than just a tool — it’s a strategic catalyst,” Prayas notes
The post How Prayas Lohalekar is transforming enterprise IT with GenAI tools appeared first on Digital Journal.",Digital Journal,https://www.digitaljournal.com/tech-science/how-prayas-lohalekar-is-transforming-enterprise-it-with-genai-tools/article,05-11-2024 21:12,gen ai tool strategic catalyst praya note post praya lohalekar transforming enterprise genai tool appeared first digital journal
Brazil’s Central Bank Previews Contactless Pix Payments,"Contactless Google Wallet payments are coming to Brazil’s Pix system. The country’s central bank this week previewed the new offering — Pix by Proximity — on Monday (Nov. 4), with central bank (BC) President Roberto Campos Neto joined by Fábio Coelho, preside…",pymnts.com,https://www.pymnts.com/digital-payments/2024/brazils-central-bank-previews-contactless-pix-payments/,05-11-2024 21:04,contactless google wallet payment coming brazil pix system country central bank week previewed new offering pix proximity monday nov central bank bc president roberto campos neto joined fbio coelho preside
Earnings call: Silicon Labs reported a revenue of $166 million,Earnings call: Silicon Labs reported a revenue of $166 million,Investing.com,https://www.investing.com/news/stock-market-news/earnings-call-silicon-labs-reported-a-revenue-of-166-million-93CH-3703324,05-11-2024 19:24,earnings call silicon lab reported revenue million
Palantir shares surge to record as AI boom powers forecast raise - Yahoo Finance,Palantir shares surge to record as AI boom powers forecast raiseYahoo Finance View Full Coverage on Google News ...,Slashdot.org,https://slashdot.org/firehose.pl?op=view&amp;id=175409299,05-11-2024 17:33,palantir share surge record ai boom power forecast raiseyahoo finance view full coverage google news
Exploring The Career Path From IRO To CFO,"Also in the Forbes CFO newsletter: Why controlling leases is important, Boeing union ends strike, Nvidia becomes the world's most valuable company.",Forbes,https://www.forbes.com/sites/cfo/2024/11/05/exploring-the-career-path-from-iro-to-cfo/,05-11-2024 17:02,also forbes cfo newsletter controlling lease important boeing union end strike nvidia becomes world valuable company
Exploring the Future of Finance: A Deep Dive into Digital Payments,"Background In today’s fast-paced world, cash and checks are increasingly giving way to faster, more...",Finextra,https://www.finextra.com/blogposting/27147/exploring-the-future-of-finance-a-deep-dive-into-digital-payments,05-11-2024 16:53,background today fastpaced world cash check increasingly giving way faster
Meta’s military push is as much about the battle for open-source AI as it is about actual battles,"Meta makes its model available to the U.S. military with a pitch that's largely about defending its ""open source AI"" framing.",Fortune,https://fortune.com/2024/11/05/metas-military-push-battle-for-open-source-ai/,05-11-2024 16:43,meta make model available u military pitch thats largely defending open source ai framing
Obama Administration Shut Down Investigation of Hezbollah as Criminal Enterprise,"Did his attempt to curry favor with Iran work? One of the ways Hezbollah earns money — about one billion dollars a year — is by drug trafficking. It controls much of the sale of drugs sent from Colombia and Venezuela to customers in the United States, Europe,…",Freerepublic.com,https://freerepublic.com/focus/f-news/4275888/posts,05-11-2024 15:02,attempt curry favor iran work one way hezbollah earns money one billion dollar year drug trafficking control much sale drug sent colombia venezuela customer united state europe
Polymarket paid U.S. social media influencers for election content,"The majority are meme pages with account names like @moist, @hoodclips, and @historyinmemes, while others are personal finance influencers such as Eric Pan of @ericnomics.",Fortune,https://fortune.com/2024/11/05/polymarket-paid-us-social-media-influencers-election-content-trump-harris/,05-11-2024 12:52,majority meme page account name like moist hoodclips historyinmemes others personal finance influencers eric pan ericnomics
U.S. CISA adds PTZOptics camera bugs to its Known Exploited Vulnerabilities catalog,U.S. Cybersecurity and Infrastructure Security Agency (CISA) adds PTZOptics PT30X-SDI/NDI camera bugs to its Known Exploited Vulnerabilities catalog. The U.S. Cybersecurity and Infrastructure Security Agency (CISA) added the following vulnerabilities to its K…,Securityaffairs.com,https://securityaffairs.com/170595/security/u-s-cisa-adds-ptzoptics-camera-bugs-to-its-known-exploited-vulnerabilities-catalog.html,05-11-2024 12:23,u cybersecurity infrastructure security agency cisa add ptzoptics ptxsdindi camera bug known exploited vulnerability catalog u cybersecurity infrastructure security agency cisa added following vulnerability k
Canadian authorities arrested alleged Snowflake hacker,"Canadian authorities arrested a suspect linked to multiple hacks following a breach of cloud data platform Snowflake earlier this year. Canadian law enforcement agencies arrested a suspect, Alexander “Connor” Moucka (aka Judische and Waifu), who is accused of…",Securityaffairs.com,https://securityaffairs.com/170587/cyber-crime/canadian-authorities-arrested-snowflake-hacker.html,05-11-2024 11:19,canadian authority arrested suspect linked multiple hack following breach cloud data platform snowflake earlier year canadian law enforcement agency arrested suspect alexander connor moucka aka judische waifu accused
The 6 best Mint alternatives to replace the budgeting app that shut down,"As a long-time Mint user, I was frustrated to say the least when news broke at the end of 2023 that Intuit would shut Mint down. I, like millions of others, enjoyed how easily Mint allowed us to track all accounts in one place and monitor credit scores. I als…",Slashdot.org,https://slashdot.org/firehose.pl?op=view&amp;id=175405661,05-11-2024 10:12,longtime mint user frustrated say least news broke end intuit would shut mint like million others enjoyed easily mint allowed u track account one place monitor credit score al
The 6 best Mint alternatives to replace the budgeting app that shut down,"As a long-time Mint user, I was frustrated to say the least when news broke at the end of 2023 that Intuit would shut Mint down. I, like millions of others, enjoyed how easily Mint allowed us to track all accounts in one place and monitor credit scores. I als…",Yahoo Entertainment,https://consent.yahoo.com/v2/collectConsent?sessionId=1_cc-session_518ab502-e617-4e51-9b96-bff742ee0d0b,05-11-2024 10:01,longtime mint user frustrated say least news broke end intuit would shut mint like million others enjoyed easily mint allowed u track account one place monitor credit score al
"Android flaw CVE-2024-43093 may be under limited, targeted exploitation","Google warned that a vulnerability, tracked as CVE-2024-43093, in the Android OS is actively exploited in the wild. Threat actors are actively exploiting a vulnerability, tracked as CVE-2024-43093, in the Android OS, Google warns. The vulnerability is a privi…",Securityaffairs.com,https://securityaffairs.com/170581/uncategorized/cve-2024-43093-android-flaw-actively-exploited.html,05-11-2024 08:51,google warned vulnerability tracked cve android o actively exploited wild threat actor actively exploiting vulnerability tracked cve android o google warns vulnerability privi
OpenAI Newly Released SimpleQA Helps Reveal That Generative AI Blatantly And Alarmingly Overstates What It Knows,"OpenAI released SimpleQA, a new benchmark for generative AI. During the work, they uncovered a serious qualm about AI being supremely overconfident. Here's the scoop.",Forbes,https://www.forbes.com/sites/lanceeliot/2024/11/05/openai-newly-released-simpleqa-helps-reveal-that-generative-ai-blatantly-and-alarmingly-overstates-what-it-knows/,05-11-2024 07:11,openai released simpleqa new benchmark generative ai work uncovered serious qualm ai supremely overconfident here scoop
What next for the Dublin Airport passenger cap?,"The best news, analysis and comment from The Irish Times business desk",The Irish Times,https://www.irishtimes.com/business/2024/11/05/what-next-for-the-dublin-airport-passenger-cap/,05-11-2024 06:37,best news analysis comment irish time business desk
Metaplanet Joins CoinShares' Blockchain Equity Index in First Global Listing,Metaplanet is touting enhanced shareholder value through “disciplined Bitcoin accumulation” following its inclusion in the CoinShares Index.,Decrypt,https://decrypt.co/290172/metaplanet-joins-coinshares-blockchain-equity-index-in-first-global-listing,05-11-2024 05:06,metaplanet touting enhanced shareholder value disciplined bitcoin accumulation following inclusion coinshares index
"SEO-Monatsrückblick Oktober 2024: AI-Suchmaschinen, Product Grids + mehr [Search Camp 346]",Dein Ticket für die Online Expert Days (OMX  + SEOkomm) Mit dem Code BLOOFUSION24 sparst Du nochmal 25 Euro netto beim Ticketkauf: Jetzt noch schnell ein Ticket sichern! AI #1 https://www.seroundtable.com/chatgpt-search-38337.html #2 https://the-decoder.de/ch…,Bloofusion.de,https://blog.bloofusion.de/seo-oktober-2024/,05-11-2024 05:00,dein ticket fr die online expert day omx seokomm mit dem code bloofusion sparst du nochmal euro netto beim ticketkauf jetzt noch schnell ein ticket sichern ai
"Share Market Highlights November 5, 2024: Sensex surges 694 pts, Nifty settles above 24,200; metal, bank stocks shine","Sensex, Nifty updates on November 5, 2024: Indian equity benchmarks rebounded on Tuesday, with the Sensex rising 694.39 points or 0.88 per cent to 79,476.63 and the Nifty up 217.95 points or 0.91 per cent at 24,213.30. All sectoral indices except FMCG and Med…",BusinessLine,https://www.thehindubusinessline.com/markets/share-market-highlights-5-november-2024/article68829273.ece,05-11-2024 01:10,sensex nifty update november indian equity benchmark rebounded tuesday sensex rising point per cent nifty point per cent sectoral index except fmcg med
Trump or Harris? The Stakes Couldn’t Be Higher,"This post Trump or Harris? The Stakes Couldn’t Be Higher appeared first on Daily Reckoning.
We'll see what America thinks tomorrow
The post Trump or Harris? The Stakes Couldn’t Be Higher appeared first on Daily Reckoning.",Dailyreckoning.com,https://dailyreckoning.com/trump-or-harris-the-stakes-couldnt-be-higher/,04-11-2024 23:00,post trump harris stake couldnt higher appeared first daily reckoning well see america think tomorrow post trump harris stake couldnt higher appeared first daily reckoning
All of the winners from The Drum Awards for Advertising 2024,"FCB Chicago took the Grand Prix for its work with Dramamine, while David Madrid received the President’s Award for its work with JCDecaux.As part of The Drum’s annual Awards Festival, today we celebrated The Drum Awards for Advertising.Taking home the top pri…",The Drum,https://www.thedrum.com/news/2024/11/04/all-the-winners-the-drum-awards-advertising-2024,04-11-2024 23:00,fcb chicago took grand prix work dramamine david madrid received president award work jcdecauxas part drum annual award festival today celebrated drum award advertisingtaking home top pri
Amazon's a company investors can 'put money to work in': Analyst,"Big tech companies, including Amazon (AMZN), Meta Platforms (META), and Alphabet (GOOG, GOOGL), posted solid third earnings this season. Despite the strong...",Yahoo Entertainment,https://finance.yahoo.com/video/amazons-company-investors-put-money-225700217.html,04-11-2024 22:57,big tech company including amazon amzn meta platform meta alphabet goog googl posted solid third earnings season despite strong
"July 2024 ransomware attack on the City of Columbus impacted 500,000 people","The July 2024 ransomware attack that hit the City of Columbus, Ohio, exposed the personal and financial data of 500,000 individuals. On July 18, 2024, the City of Columbus, Ohio, suffered a cyber attack that impacted the City’s services. On July 29, 2024, the…",Securityaffairs.com,https://securityaffairs.com/170568/data-breach/city-of-columbus-ransomware-attack-impacted-500000-people.html,04-11-2024 22:53,july ransomware attack hit city columbus ohio exposed personal financial data individual july city columbus ohio suffered cyber attack impacted city service july
Elon Musk Is His Own Rogue Nation,"The world’s richest man and top Trump supporter profits off the U.S. security state while back-channeling with Putin.
The post Elon Musk Is His Own Rogue Nation appeared first on The Intercept.",The Intercept,https://theintercept.com/2024/11/04/elon-musk-trump-russia-starlink/,04-11-2024 22:07,world richest man top trump supporter profit u security state backchanneling putin post elon musk rogue nation appeared first intercept
Stock market today: Dow leads stocks lower as Wall Street braces for Election Day,Investors are bracing for a week of potentially huge market-moving events — the presidential election and the Federal Reserve policy decision.,Yahoo Entertainment,https://finance.yahoo.com/news/live/stock-market-today-dow-leads-stocks-lower-as-wall-street-braces-for-election-day-210042676.html,04-11-2024 21:00,investor bracing week potentially huge marketmoving event presidential election federal reserve policy decision
Intuit QuickBooks Solopreneur,"Basic accounting tools for sole proprietors
Intuit's QuickBooks Solopreneur aims to build on the success of QuickBooks Self-Employed, which is no longer available to new users. The small business accounting application targets sole proprietors, offering basic…",PCMag.com,https://me.pcmag.com/en/smb-accounting/26713/intuit-quickbooks-solopreneur,04-11-2024 18:35,basic accounting tool sole proprietor intuits quickbooks solopreneur aim build success quickbooks selfemployed longer available new user small business accounting application target sole proprietor offering basic
Intuit QuickBooks Solopreneur,"Basic accounting tools for sole proprietors
Intuit's QuickBooks Solopreneur aims to build on the success of QuickBooks Self-Employed, which is no longer available to new users. The small business accounting application targets sole proprietors, offering basic…",PCMag.com,https://uk.pcmag.com/smb-accounting/155171/intuit-quickbooks-solopreneur,04-11-2024 18:35,basic accounting tool sole proprietor intuits quickbooks solopreneur aim build success quickbooks selfemployed longer available new user small business accounting application target sole proprietor offering basic
The Struggle for Power in America,"The problems of the 21st century are echoing those of the 18th—and the solutions will, too.
The post The Struggle for Power in America  appeared first on The American Conservative.",The American Conservative,https://www.theamericanconservative.com/the-struggle-for-power-in-america/,04-11-2024 17:00,problem st century echoing thand solution post struggle power america appeared first american conservative
"Transcript: Annie Lamont, Oak HC/FT","﻿     The transcript from this week’s, MiB: Annie Lamont, Managing Partner of Oak HC/FT, is below. You can stream and download our full conversation, including any podcast extras, on Apple Podcasts, Spotify, YouTube, and Bloomberg. All of our earlier podcasts…",Ritholtz.com,https://ritholtz.com/2024/11/transcript-annie-lamont/,04-11-2024 16:30,transcript week mib annie lamont managing partner oak hcft stream download full conversation including podcast extra apple podcasts spotify youtube bloomberg earlier podcasts
