Title,Description,Publisher,Link,Published Time,processed_text
Dow Jones Futures Dip Ahead Of Fed Speeches; Netflix Surges On Earnings - Investor's Business Daily,"Dow Jones Futures Dip Ahead Of Fed Speeches; Netflix Surges On EarningsInvestor's Business Daily Nasdaq rises as Netflix pops on strong earnings: Live updatesCNBC Netflix earnings, S&P 500 record, CVS CEO changeup: 3 ThingsYahoo Finance CVS, Nvidia, Netflix, …",Slashdot.org,https://slashdot.org/firehose.pl?op=view&amp;id=175277463,18-10-2024 13:53,dow jones future dip ahead fed speech netflix surge earningsinvestors business daily nasdaq rise netflix pop strong earnings live updatescnbc netflix earnings sp record cv ceo changeup thingsyahoo finance cv nvidia netflix
"Netflix's subscriber growth is slowing, but its profit and stock price are still surging","Netflix's subscriber growth is slowing, but its profit and stock price are still surging ABC News
Netflix earnings, subscriber growth top estimates as investors eye potential price hikes Yahoo Finance
Bank of America hikes Nvidia price target, says shares can…",Biztoc.com,https://biztoc.com/x/df92fd002b8f4fcf,18-10-2024 12:37,netflixs subscriber growth slowing profit stock price still surging abc news netflix earnings subscriber growth top estimate investor eye potential price hike yahoo finance bank america hike nvidia price target say share
Forbes Daily: ‘Insane’ AI Demand Drives A Market Surge For Chip Giants,"Friday's edition of Forbes Daily covers Elon Musk's mysterious companies, decoding animal communication with AI, Netflix's subscriber boost, Hamas leader killed and more.",Forbes,https://www.forbes.com/sites/daniellechemtob/2024/10/18/forbes-daily-insane-ai-demand-drives-a-market-surge-for-chip-giants/,18-10-2024 11:49,friday edition forbes daily cover elon musk mysterious company decoding animal communication ai netflixs subscriber boost hamas leader killed
