Title,Description,Publisher,Link,Published Time,processed_text
Martha Stewart was America's first self-made female billionaire. Here's how she makes and spends her fortune.,"Martha Stewart lost her billionaire status following her stock-trading scandal, but she continues to live a lavish life.",Business Insider,https://www.businessinsider.com/martha-stewart-net-worth-makes-spends-her-millions,06-11-2024 15:37,martha stewart lost billionaire status following stocktrading scandal continues live lavish life
"Riot Games After 'Arcane,' Most Expensive Animated Series Ever","Riot Games' Hollywood ambitions were stymied by inexperience after the success of Netflix's 'Arcane,' which cost $250M over 18 episodes.",Variety,https://variety.com/2024/biz/news/riot-games-arcane-hollywood-netflix-most-expensive-animated-series-ever-1236196655/,06-11-2024 14:30,riot game hollywood ambition stymied inexperience success netflixs arcane cost episode
Earth 2 at 30: A look back at NBC’s big swing at sci-fi in the early ’90s,"A long-forgotten sci-fi series premiered on NBC 30 years ago this month, but it paved the way for some of the shows that came after it.",Digital Trends,https://www.digitaltrends.com/movies/earth-2-at-30-a-look-back-at-nbcs-big-swing-at-sci-fi-in-the-90s/,06-11-2024 13:30,longforgotten scifi series premiered nbc year ago month paved way show came
"Chloe Fineman, Patton Oswalt Join Pickleball Comedy 'The Dink'","Chloe Fineman, Patton Oswalt, John McEnroe, Aaron Chen, Martin Kove, Chris Parnell and Christine Taylor have joined the pickleball comedy 'The Dink'",Variety,https://variety.com/2024/film/news/chloe-fineman-patton-oswalt-john-mcenroe-join-pickleball-comedy-the-dink-1236200336/,04-11-2024 23:30,chloe fineman patton oswalt john mcenroe aaron chen martin kove chris parnell christine taylor joined pickleball comedy dink
"Compulsion: Neil Marshall psychological thriller unveils a first look image, secures Saban Films distribution","Neil Marshall and Charlotte Kirk have teamed up again for the erotic thriller Compulsion, which has just unveiled a first look image
The post Compulsion: Neil Marshall psychological thriller unveils a first look image, secures Saban Films distribution appeare…",JoBlo.com,https://www.joblo.com/compulsion-image/,04-11-2024 17:16,neil marshall charlotte kirk teamed erotic thriller compulsion unveiled first look image post compulsion neil marshall psychological thriller unveils first look image secures saban film distribution appeare
Newly minted unicorn: Jamie Beaton’s Crimson raises $68m at $1b valuation,'It's the single biggest cheque we've ever written.',New Zealand Herald,https://www.nzherald.co.nz/business/newly-minted-unicorn-jamie-beatons-crimson-raises-68-million-at-1-billion-valuation/OIZMZBWJIRAQXLKL3AFULGU3CA/,04-11-2024 16:00,single biggest cheque weve ever written
Ben Affleck & Matt Damon on Easy Decision to Team with Cillian Murphy (Exclusive),"Oscar winners Cillian Murphy, Ben Affleck and Matt Damon spoke to “Extra’s” Terri Seymour about “Small Things Like These,” their new film adaptation of the Claire Keegan novel. 
 Ben and Matt financed the film through their company Artists Equity, and Ben sha…",Extra,https://extratv.com/2024/11/04/ben-affleck-and-matt-damon-on-easy-decision-to-team-with-cillian-murphy-exclusive/,04-11-2024 15:30,oscar winner cillian murphy ben affleck matt damon spoke extra terri seymour small thing like new film adaptation claire keegan novel ben matt financed film company artist equity ben sha
"The Veterans Founders Vincent Maraval & Kim Fox, Coming Off $100M In Cannes Sales, Talk ‘Emilia Pérez’ Gamble, Movie Taste & What’s Next","EXCLUSIVE: It takes a certain kind of confidence to take a finished indie film to market with no presales, but if that completed film is a $24 million Spanish-language musical directed by a French auteur about a Mexican cartel leader that transitions from mal…",Deadline,http://deadline.com/2024/11/the-veterans-vincent-maraval-kim-fox-emilia-perez-gamble-movie-taste-whats-next-afm-cannes-1236163203/,04-11-2024 15:13,exclusive take certain kind confidence take finished indie film market presales completed film million spanishlanguage musical directed french auteur mexican cartel leader transition mal
"Why Companies Shoot in Spain, From Locations to Facilities, Muscular Incentives, Shows’ Concepts, Local Talent Pools and Because the Country Features in the Screenplay","Russell Crowe starrer “The Last Druid” must rate as one of the highest-profile projects being brought to market at this week’s American Film Market. Its partners – Range Media Partners, Spain’s Nostromo, CAA Media Finance and AGC International – are aiming to…",Variety,https://variety.com/2024/film/global/russell-crowe-norman-reedus-guy-ritchie-tom-hardy-1236199515/,04-11-2024 14:27,russell crowe starrer last druid must rate one highestprofile project brought market week american film market partner range medium partner spain nostromo caa medium finance agc international aiming
"Earnings call: Swisscom reports stable Q3 with focus on B2B growth, 5G","Earnings call: Swisscom reports stable Q3 with focus on B2B growth, 5G",Investing.com,https://www.investing.com/news/stock-market-news/earnings-call-swisscom-reports-stable-q3-with-focus-on-b2b-growth-5g-93CH-3698755,04-11-2024 08:00,earnings call swisscom report stable q focus bb growth g
"‘The Bureau’ Producer Alex Berger, ‘Anikulapo’s’ Kunle Afolayan Headline Ivory Coast’s SICA Film and TV Industry Trade Fair","Alex Berger of “The Bureau” producer TOP (The Oligarchs Productions), prolific Nigerian filmmaker Kunle Afolayan (“Aníkúlápó”) and Sydney Gallonde of Paris-based outfit Make it Happens Studios are among the headliners of the Salon International du Contenu Aud…",Variety,https://variety.com/2024/film/global/alex-berger-kunle-afolayan-sica-ivory-coast-african-content-1236192739/,01-11-2024 22:53,alex berger bureau producer top oligarch production prolific nigerian filmmaker kunle afolayan anklp sydney gallonde parisbased outfit make happens studio among headliner salon international du contenu aud
So what if Martha Stewart is a perfectionist control freak?,"Halfway through the run of Martha, the new Netflix documentary about the former domestic goddess-turned-Sports Illustrated cover star, Martha Stewart lingers over the moment in 2004 when she received a guilty verdict at the end of her high-profile insider tra…",Vox,https://www.vox.com/culture/381802/martha-stewart-documentary-netflix-review,01-11-2024 22:16,halfway run martha new netflix documentary former domestic goddessturnedsports illustrated cover star martha stewart lingers moment received guilty verdict end highprofile insider tra
Danny Ramirez Grabs Directing ‘Baton’; Victoria Alonso & David Beckham To Produce Soccer Drama,"EXCLUSIVE: Danny Ramirez, the fast-rising star soon to be seen in Captain America: Brave New World, will make his feature directorial debut with Baton, a sports drama that he’ll star in and also wrote. Baton follows a soccer player, relentlessly pursuing his …",Deadline,http://deadline.com/2024/11/danny-ramirez-victoria-alonso-david-beckham-teaming-baton-movie-1236164888/,01-11-2024 21:51,exclusive danny ramirez fastrising star soon seen captain america brave new world make feature directorial debut baton sport drama hell star also wrote baton follows soccer player relentlessly pursuing
Dev Patel Boards AGC’s Tennis Thriller ‘The Journeyman’ From Tarsem Singh,"Oscar nominee Dev Patel (Slumdog Millionaire) is set to star in The Journeyman, a new crime thriller fro director Tarsem Singh (The Fall) and Stuart Ford’s AGC Studios, which will produce and fully finance the project. AGC International reps the film’s intern…",Deadline,http://deadline.com/2024/11/dev-patel-joins-the-journeyman-thriller-tarsem-singh-agc-studios-1236164375/,01-11-2024 15:00,oscar nominee dev patel slumdog millionaire set star journeyman new crime thriller fro director tarsem singh fall stuart ford agc studio produce fully finance project agc international rep film intern
Europe’s Existential AI Challenge,"If the European Union and its member states want to thrive and safeguard their sovereignty in the twenty-first century, they must get their commercial house in order. In the age of AI, a competitive startup ecosystem is a critical component of economic prospe…",Project Syndicate,https://www.project-syndicate.org/onpoint/europe-will-lose-ai-race-unless-it-fixes-startup-ecosystem-by-bertrand-badre-and-charles-ferguson-2024-11,01-11-2024 09:48,european union member state want thrive safeguard sovereignty twentyfirst century must get commercial house order age ai competitive startup ecosystem critical component economic prospe
[Finterest] Are global tech funds the missing piece in your investment portfolio?,Rappler spoke with Pru Life UK and ATRAM to learn more about their global tech fund that invests in the tech titans that power today's digital world,Rappler,https://www.rappler.com/business/finterest-global-tech-funds-missing-piece-investment-portfolio/,01-11-2024 00:28,rappler spoke pru life uk atram learn global tech fund invests tech titan power today digital world
‘The Hole’: Theo James To Star In Korean Director Kim Jee-Woon’s Return To Horror Genre,"Theo James, horror movie regular? That looks to be the latest trend for the British actor, as he’ll follow up starring in Oz Perkins‘ “The Monkey” with Korean director Kim Jee-woon‘s latest genre venture, “The Hole.”
READ MORE: 2024 Fall Film Preview: 50 Movi…",Theplaylist.net,https://theplaylist.net/the-hole-theo-james-to-star-in-korean-director-kim-jee-woons-return-to-horror-genre-20241031/,31-10-2024 19:09,theo james horror movie regular look latest trend british actor hell follow starring oz perkins monkey korean director kim jeewoons latest genre venture hole read fall film preview movi
The Indie Film Business Tries on New and Old Business Models as Uncertain AFM Hits Las Vegas,"In recent years, the film and TV business has been living under an ever-mutating version of the apocryphal Chinese curse “May you live in interesting times,” and the American Film Market — which runs from Nov. 5-10 at the Palms Casino Resort in Las Vegas — ha…",Variety,https://variety.com/2024/film/markets-festivals/indie-producers-finance-model-afm-1236194434/,31-10-2024 17:05,recent year film tv business living evermutating version apocryphal chinese curse may live interesting time american film market run nov palm casino resort la vega ha
'Cliffhanger' Reboot: Lily James and Pierce Brosnan to Star,"In a full creative overhaul, the reboot of Sly Stallone's ""Cliffhanger"" will now star Lily James and Pierce Brosnan for director Jaume Collet-Serra.",Variety,https://variety.com/2024/film/news/cliffhanger-reboot-lily-james-pierce-brosnan-stallone-out-1236139856/,31-10-2024 16:15,full creative overhaul reboot sly stallones cliffhanger star lily james pierce brosnan director jaume colletserra
Theo James To Star In Kim Jee-Woon’s ‘The Hole’; The Veterans Launching Sales On Thriller At AFM,"EXCLUSIVE: Theo James (The Gentleman) is set to star in The Hole, directed by Kim Jee-woon (I Saw The Devil) and written by Christopher Chen based on the 2017 Shirley Jackson award winning novel of the same name by Hye-young Pyun.  Esmail Corp (Leave the Worl…",Deadline,http://deadline.com/2024/10/theo-james-to-star-in-kim-jee-woon-the-hole-the-veterans-afm-1236163392/,31-10-2024 16:11,exclusive theo james gentleman set star hole directed kim jeewoon saw devil written christopher chen based shirley jackson award winning novel name hyeyoung pyun esmail corp leave worl
AI Misuse Statistics: 50+ Worrying Stats and Facts,"These eye-opening AI misuse statistics will show you how not all applications of AI are positive. Artificial intelligence is now a key part of our daily lives. From medical research to student learning tools, it’s already streamlining industries across the bo…",MSPoweruser,https://mspoweruser.com/ai-misuse-statistics/,31-10-2024 15:33,eyeopening ai misuse statistic show application ai positive artificial intelligence key part daily life medical research student learning tool already streamlining industry across bo
"Halloween haunted houses are a scary business proposition, operators say","Scaring people for a living is a tough racket. ""A bunch of teenagers that say 'Boo!' — that won't fly anymore,"" one haunted house veteran says.",CBS News,https://www.cbsnews.com/news/halloween-haunted-houses-business-proposition/,31-10-2024 09:00,scaring people living tough racket bunch teenager say boo wont fly anymore one haunted house veteran say
Google Sheds No Tears At Its ‘Funeral’ For Blogs; Rage Against The Recommendation Machine,Here’s today’s AdExchanger.com news round-up… Want it by email? Sign up here. Whose Funeral? Google Search upended online traffic earlier this year with a core update as a follow-up to its “helpful content update” last September.  The long and short of it is …,AdExchanger,http://www.adexchanger.com/daily-news-roundup/thursday-31102024/,31-10-2024 04:03,here today adexchangercom news roundup want email sign whose funeral google search upended online traffic earlier year core update followup helpful content update last september long short
"Jay Duplass Sets Star-Studded Cast For Family Drama ‘See You When I See You’; Cooper Raiff, David Duchovny, Hope Davis Among Those Starring","EXCLUSIVE: More than a decade after his last feature directorial outing with The Do-Deca-Pentathlon, Jay Duplass is back behind the camera for See You When I See You, a comedic family drama to star Cooper Raiff (Cha Cha Real Smooth), David Duchovny (Californi…",Deadline,http://deadline.com/2024/10/jay-duplass-movie-see-you-when-i-see-you-to-star-cooper-raiff-1236161506/,30-10-2024 16:00,exclusive decade last feature directorial outing dodecapentathlon jay duplass back behind camera see see comedic family drama star cooper raiff cha cha real smooth david duchovny californi
Everything We Learned From Martha Stewart’s New Documentary,"In Netflix’s ‘Martha,’ Martha Stewart opens up about her ex-husband cheating on her, her insider-trading scandal, and more.",The Cut,http://www.thecut.com/article/martha-stewart-documentary-biggest-takeaways.html,30-10-2024 15:56,netflixs martha martha stewart open exhusband cheating insidertrading scandal
Presentation: Strategic Thinking for Staff+ Engineers,"Shweta Saraf discusses a framework for developing strategic thinking at any career stage, with a special focus on Staff+ engineers. By Shweta Saraf",InfoQ.com,https://www.infoq.com/presentations/staff-strategic-thinking/,30-10-2024 10:33,shweta saraf discus framework developing strategic thinking career stage special focus staff engineer shweta saraf
Engineers: Heal Thyselves (and Health Care),By KIM BELLARD The article I can’t get out of my head is one by Greg Ip in The Wall Street Journal: Crises at Boeing and Intel Area National Emergency. I’m oldContinue reading...,Thehealthcareblog.com,https://thehealthcareblog.com/blog/2024/10/30/engineers-heal-thyselves-and-health-care/,30-10-2024 05:15,kim bellard article cant get head one greg ip wall street journal crisis boeing intel area national emergency im oldcontinue reading
Ansel Elgort to Star in Survival Thriller ‘Faster Than Horses’; Upgrade Launches Sales at AFM,"“West Side Story” actor Ansel Elgort is set to star in “Faster Than Horses,” a survival thriller directed by Emmy nominee James Erskine (“Shooting for Socrates “) and produced by survival expert Bear Grylls. Inspired by a true story and based on an article by…",Variety,https://variety.com/2024/film/global/ansel-elgort-faster-than-horses-afm-1236194044/,29-10-2024 19:38,west side story actor ansel elgort set star faster horse survival thriller directed emmy nominee james erskine shooting socrates produced survival expert bear grylls inspired true story based article
‘The Substance’ Star Margaret Qualley To Play ‘Victorian Psycho’ In Gothic Horror From ‘Longlegs’ Producer; Anton Launching For AFM,"EXCLUSIVE: Fresh off acclaimed genre pic The Substance, Margaret Qualley has been set to star in psychological horror-thriller Victorian Psycho, which Anton is launching ahead of next week’s American Film Market. It’s a strong premise for the in-demand Qualle…",Deadline,http://deadline.com/2024/10/margaret-qualley-victorian-psycho-horror-film-substance-afm-1236160838/,29-10-2024 17:17,exclusive fresh acclaimed genre pic substance margaret qualley set star psychological horrorthriller victorian psycho anton launching ahead next week american film market strong premise indemand qualle
"Transcript: Toto Wolff, Mercedes-AMG PETRONAS F1 Team","The transcript from this week’s, MiB: Toto Wolff, Mercedes-AMG PETRONAS F1 Team, is below. You can stream and download our full conversation, including any podcast extras, on Apple Podcasts, Spotify, YouTube, and Bloomberg. All of our earlier podcasts on your…",Ritholtz.com,https://ritholtz.com/2024/10/transcript-toto-wolff-mercedes/,28-10-2024 12:30,transcript week mib toto wolff mercedesamg petronas f team stream download full conversation including podcast extra apple podcasts spotify youtube bloomberg earlier podcasts
"Alphabet's Q3 revenue growth likely to slow as competition pressures Search, YouTube",The slowdown in its core business is expected to overshadow AI-driven gains at its cloud-computing business in the third quarter. This quarter was also the company's first since Anat Ashkenazi took over as finance chief from Ruth Porat.,The Times of India,https://economictimes.indiatimes.com/tech/technology/alphabets-q3-revenue-growth-likely-to-slow-as-competition-pressures-search-youtube/articleshow/114689410.cms,28-10-2024 10:05,slowdown core business expected overshadow aidriven gain cloudcomputing business third quarter quarter also company first since anat ashkenazi took finance chief ruth porat
"Alphabet's Q3 revenue growth likely to slow as competition pressures Search, YouTube","Alphabet will likely post its slowest revenue growth in four quarters on Tuesday, hurt by competition that weighed on its core Google Search business and dented YouTube ad spending.The slowdown in its core business is expected to overshadow AI-driven gains at…",CNA,https://www.channelnewsasia.com/business/alphabets-q3-revenue-growth-likely-slow-competition-pressures-search-youtube-4707316,28-10-2024 10:04,alphabet likely post slowest revenue growth four quarter tuesday hurt competition weighed core google search business dented youtube ad spendingthe slowdown core business expected overshadow aidriven gain
The List of People Trump Pardoned in Office Is Strangely Revealing,The characters are way weirder than you remember.,Slate Magazine,https://slate.com/news-and-politics/2024/10/donald-trump-presidential-election-pardon-2024-crime-list.html,28-10-2024 09:41,character way weirder remember
What is named entity recognition (NER)?,Named entity recognition (NER) is a natural language processing (NLP) method that extracts information from text.,Techtarget.com,https://www.techtarget.com/whatis/definition/named-entity-recognition-NER,28-10-2024 09:00,named entity recognition ner natural language processing nlp method extract information text
Magnificent 7 shake-up: Why Wall Street is reassessing Tesla's position and looking toward Netflix,"Despite a monstrous earnings report, Wall Street is once again reevaluating the stock's inclusion in the Magnificent 7.",Yahoo Entertainment,https://finance.yahoo.com/news/magnificent-7-shake-up-why-wall-street-is-reassessing-teslas-position-and-looking-toward-netflix-130053237.html,27-10-2024 13:00,despite monstrous earnings report wall street reevaluating stock inclusion magnificent
From Nvidia to nuclear power to extra spicy hot sauce,Lots of stories get overlooked during earnings seasons.,Yahoo Entertainment,https://finance.yahoo.com/news/from-nvidia-to-nuclear-power-to-extra-spicy-hot-sauce-123010664.html,27-10-2024 12:30,lot story get overlooked earnings season
"Every Nicole Kidman TV Show, Ranked","Over the past decade, Nicole Kidman has become one of the most visible A-listers on television, with a new show nearly every year. We rank them all.",Vulture,http://www.vulture.com/article/the-best-nicole-kidman-tv-shows-ranked.html,26-10-2024 16:54,past decade nicole kidman become one visible alisters television new show nearly every year rank
Michigan State football vs. Michigan: How the state of rivalry turned toxic,A brief history of Michigan football and Michigan State's recent rivalry showdowns and the scandals that have marred them.,Detroit Free Press,https://www.freep.com/story/sports/college/2024/10/26/michigan-state-football-vs-michigan-how-rivalry-turned-toxic/75808104007/,26-10-2024 10:04,brief history michigan football michigan state recent rivalry showdown scandal marred
Chart of the Week: Taking a closer look at the Magnificent Seven,"This week, all members of the ""Magnificent Seven"" were back in the green after Tesla's massive run Thursday. But looking closer into the year-to-date...",Yahoo Entertainment,https://finance.yahoo.com/news/chart-of-the-week-taking-a-closer-look-at-the-magnificent-seven-100014792.html,26-10-2024 10:00,week member magnificent seven back green tesla massive run thursday looking closer yeartodate
"Woman Of The Hour Is The Most Popular Netflix Film In The US Right Now (And Rightfully So), But Shockingly One Other New Movie Is Beating It Globally",Woman of the Hour shockingly falls short of hitting Netflix’s global spot.,CinemaBlend,https://www.cinemablend.com/streaming-news/woman-of-the-hour-most-popular-netflix-film-us-beating-it-globally-lonely-planet,25-10-2024 20:31,woman hour shockingly fall short hitting netflixs global spot
"Alicia Vikander, Victoria Pedretti and Wagner Moura to Star in Rachel Rose’s Debut Film ‘The Last Day’ (EXCLUSIVE)","Alicia Vikander will lead Rachel Rose’s debut film “The Last Day” alongside Victoria Pedretti and Wagner Moura. The film, which wrapped production in New York in October, follows a writer and mother who confronts her lack of creative purpose and embarks on a …",Variety,https://variety.com/2024/film/news/alicia-vikander-victoria-pedretti-wagner-moura-the-last-day-1236190908/,25-10-2024 17:00,alicia vikander lead rachel rose debut film last day alongside victoria pedretti wagner moura film wrapped production new york october follows writer mother confronts lack creative purpose embarks
Trump Vs. Harris Fundraising Race: Harris Outraised Trump 3-To-1 With Last Pre-Election Report,Harris' campaign and affiliated groups have raised $1 billion since she entered the race.,Forbes,https://www.forbes.com/sites/alisondurkee/2024/10/25/trump-vs-harris-fundraising-race-harris-outraised-trump-3-to-1-with-last-pre-election-report/,25-10-2024 14:39,harris campaign affiliated group raised billion since entered race
Beyond Marketing: The Role And Power Of The Chief Market Officer,"When marketing has its hand in the strategic direction of a business and can serve as that great unifier, we’re unstoppable—no magic needed.",Forbes,https://www.forbes.com/councils/forbescommunicationscouncil/2024/10/25/beyond-marketing-the-role-and-power-of-the-chief-market-officer/,25-10-2024 11:30,marketing hand strategic direction business serve great unifier unstoppableno magic needed
Dual-hesitant fermatean fuzzy Hamacher aggregation operators and TOPSIS with their application to multi-criteria decision-making,"The concept of the Dual-hesitant fermatean fuzzy set (DHFFS) represents a significant advancement in practical implementation, combining Fermatean fuzzy sets and Dual-hesitant sets. This new structure uses membership and non-membership hesitancy and is more a…",Plos.org,https://journals.plos.org/plosone/article?id=10.1371/journal.pone.0311580,24-10-2024 14:00,concept dualhesitant fermatean fuzzy set dhffs represents significant advancement practical implementation combining fermatean fuzzy set dualhesitant set new structure us membership nonmembership hesitancy
Millennials are hoarding cash. That could hurt them in the long run.,Millennials are holding onto a lot of cash instead of investing that money in the stock market. That is going to hurt them in the long run.,Business Insider,https://www.businessinsider.com/millennials-big-money-mistake-holding-cash-not-buying-stocks-investing-2024-10,24-10-2024 09:22,millennials holding onto lot cash instead investing money stock market going hurt long run
How Europe’s Biggest Buyout Deal Descended Into a Bruising Brawl,US private equity firm Clayton Dubilier & Rice thought it had a deal to buy Sanofi’s consumer business. Losing bidder PAI Partners had other ideas.,Financial Post,https://financialpost.com/pmn/business-pmn/how-europes-biggest-buyout-deal-descended-into-a-bruising-brawl,24-10-2024 04:20,u private equity firm clayton dubilier rice thought deal buy sanofis consumer business losing bidder pai partner idea
Netflix Co-CEO Ted Sarandos Defends Updating the Streamer’s Iconic Culture Memo,"""We want it to reflect how we work, not dictate how we work,"" said Netflix co-CEO Ted Sarandos of the company's renowned culture memo.",Observer,https://observer.com/2024/10/netflix-ceo-ted-sarandos-defends-company-culture-memo/,23-10-2024 18:51,want reflect work dictate work said netflix coceo ted sarandos company renowned culture memo
