Title,Description,Publisher,Link,Published Time,processed_text
From Raw Data To AI Gold: The Crucial Role Of Data Engineers In Machine Learning,"Data engineers are responsible for the management of data infrastructure, the delivery of large-scale data processing and the preparation of datasets for analysis.",Forbes,https://www.forbes.com/councils/forbestechcouncil/2024/11/01/from-raw-data-to-ai-gold-the-crucial-role-of-data-engineers-in-machine-learning/,01-11-2024 12:00,data engineer responsible management data infrastructure delivery largescale data processing preparation datasets analysis
Forbes Daily: Drone Maker To Ration Batteries After Chinese Sanctions,"Friday's edition of Forbes Daily covers David Koch's son backing Kamala Harris, Facebook profit from election lies, Amazon beats expectations, Apple's earnings and more.",Forbes,https://www.forbes.com/sites/daniellechemtob/2024/11/01/forbes-daily-drone-maker-to-ration-batteries-after-chinese-sanctions/,01-11-2024 11:53,friday edition forbes daily cover david koch son backing kamala harris facebook profit election lie amazon beat expectation apple earnings
The new CFO of a $2 billion AI firm plans to steer strategy with the CEO,Chris Nagy joins Salesloft as CFO bringing more than 25 years of experience.,Fortune,https://fortune.com/2024/11/01/the-new-cfo-of-a-2-billion-ai-firm-plans-to-steer-strategy-with-the-ceo/,01-11-2024 11:17,chris nagy join salesloft cfo bringing year experience
"Bytes: Week in Review — Apple Intelligence arrives, AI writes Google’s code, and AI medical transcription tool hallucinates","An AI transcription tool used in health care has been found to frequently hallucinate things no one ever said, including making up medications. That’s just one of the topics for today’s Marketplace Tech Bytes: Week in Review. Plus, we’ll get into what we lear…",Marketplace.org,https://www.marketplace.org/shows/marketplace-tech/bytes-week-in-review-apple-intelligence-arrives-ai-writes-googles-code-and-ai-medical-transcription-tool-hallucinates/,01-11-2024 10:04,ai transcription tool used health care found frequently hallucinate thing one ever said including making medication thats one topic today marketplace tech byte week review plus well get lear
Europe’s Existential AI Challenge,"If the European Union and its member states want to thrive and safeguard their sovereignty in the twenty-first century, they must get their commercial house in order. In the age of AI, a competitive startup ecosystem is a critical component of economic prospe…",Project Syndicate,https://www.project-syndicate.org/onpoint/europe-will-lose-ai-race-unless-it-fixes-startup-ecosystem-by-bertrand-badre-and-charles-ferguson-2024-11,01-11-2024 09:48,european union member state want thrive safeguard sovereignty twentyfirst century must get commercial house order age ai competitive startup ecosystem critical component economic prospe
