Title,Description,Publisher,Link,Published Time,processed_text
Tech Billionaires Support Both Trump And Harris—How They Risk Alienating Their Employees And Customer Base,"With billionaires outspoken about their political support, a divide between these employers and their staff could potentially create tension in the workplace.",Forbes,https://www.forbes.com/sites/jackkelly/2024/10/23/tech-billionaires-support-both-trump-and-harris-how-they-risk-alienating-their-employees-and-customer-base/,23-10-2024 14:43,billionaire outspoken political support divide employer staff could potentially create tension workplace
The share of female CEOs running Fortune 500 Europe companies drops to 6.2%,Female CEOs lose ground on the ranking of the largest companies in Europe.,Fortune,https://fortune.com/2024/10/23/the-share-of-female-ceos-running-fortune-500-europe-companies-drops-to-6-2/,23-10-2024 13:00,female ceo lose ground ranking largest company europe
Liam Hemsworth's 2024 Netflix Movie Claims No. 1 Spot On Global Chart,Liam Hemsworth and Laura Dern's romantic drama Lonely Planet climbs to the top spot on Netflix's Global Top 10 Movies chart in only its second week.,Screen Rant,https://screenrant.com/lonely-planet-netflix-viewership-numbers-chart-rank-second-week/,23-10-2024 01:48,liam hemsworth laura derns romantic drama lonely planet climb top spot netflixs global top movie chart second week
"Share Market Highlights October 23, 2024: Sensex, Nifty end in red; Bajaj Finance gains nearly 5%","Sensex, Nifty updates on October 23, 2024: Indian equity indices ended lower on Wednesday. The Sensex fell 138.74 points to 80,081.98, while the Nifty dropped 36.60 points to 24,435.50. IT stocks gained over 2 per cent, while capital goods, power, and pharma …",BusinessLine,https://www.thehindubusinessline.com/markets/stock-market-highlights-23-october-2024/article68783188.ece,23-10-2024 01:13,sensex nifty update october indian equity index ended lower wednesday sensex fell point nifty dropped point stock gained per cent capital good power pharma
2:00PM Water Cooler 10/22/2024,"~ Today's Water Cooler: Politics, syndemics ~",Nakedcapitalism.com,https://www.nakedcapitalism.com/2024/10/200pm-water-cooler-10-22-2024.html,22-10-2024 18:00,today water cooler politics syndemics
All3Media promotes finance chief John Whittle to MD of Lime Pictures,"All3Media has appointed John Whittle as MD of its Liverpool-based production outfit Lime Pictures. Whittle, who was previously Lime Pictures’ finance director, will work with the company’s creative...",C21media.net,https://www.c21media.net/news/all3media-promotes-finance-chief-john-whittle-to-md-of-lime-pictures/,22-10-2024 16:23,allmedia appointed john whittle md liverpoolbased production outfit lime picture whittle previously lime picture finance director work company creative
Why The Drop In Luxury Goods Sales Could Be An Ominous Sign,"Also in the Forbes CFO newsletter: SBA rule change allows more loans (and diversification), Boeing strike shows why raises are vital, Nvidia CEO’s fortune at new heights",Forbes,https://www.forbes.com/sites/cfo/2024/10/22/why-the-drop-in-luxury-goods-sales-could-be-an-ominous-sign/,22-10-2024 16:00,also forbes cfo newsletter sba rule change allows loan diversification boeing strike show raise vital nvidia ceo fortune new height
‘Arctic 30’: Joe Penna To Direct Eco Thriller About 2013 Greenpeace Protest That Became Global News,"EXCLUSIVE: Eco-thriller Arctic 30 is getting a shot in the arm with new partners and the update that Arctic and Stowaway director Joe Penna is aboard to direct. Based on actual events, the movie will chart the story of thirty Greenpeace activists who were det…",Deadline,http://deadline.com/2024/10/arctic-30-joe-penna-direct-eco-thriller-2013-greenpeace-protest-russia-1236144236/,22-10-2024 15:21,exclusive ecothriller arctic getting shot arm new partner update arctic stowaway director joe penna aboard direct based actual event movie chart story thirty greenpeace activist det
"Socket secures $40M to combat next-generation software supply chain security attacks led by industry titans Abstract Ventures, Elad Gil, and a16z",Socket safeguards companies from software supply chain attacks by detecting and preventing threats in open source code and empowering developers to secure their applications and critical services against malware and other security risks. Socket safeguards com…,GlobeNewswire,https://www.globenewswire.com/news-release/2024/10/22/2967115/0/en/Socket-secures-40M-to-combat-next-generation-software-supply-chain-security-attacks-led-by-industry-titans-Abstract-Ventures-Elad-Gil-and-a16z.html,22-10-2024 14:30,socket safeguard company software supply chain attack detecting preventing threat open source code empowering developer secure application critical service malware security risk socket safeguard com
Catalan Pubcaster 3Cat in Talks for Season 2 of ‘This Is Not Sweden’ (EXCLUSIVE),"Catalan public broadcaster 3Cat, formerly known as Televisió de Cataunya (TVC), is in talks to make Season 2 of ‘This is Not Sweden’ with the same creative team and producers of Season 1. A distribution deal with a platform is pending.  The Prix Europe-winnin…",Variety,https://variety.com/2024/film/global/3cat-this-is-not-sweden-mipcom-1236185880/,22-10-2024 13:40,catalan public broadcaster cat formerly known televisi de cataunya tvc talk make season sweden creative team producer season distribution deal platform pending prix europewinnin
"Former NBCU, Dick Clark Prods. Exec Adam Stotsky Joins OBB Media, Launches Branded Content Studio Bolded as President (EXCLUSIVE)","OBB Media, the production company behind Demi Lovato’s recent Hulu doc “Child Star” and Netflix’s upcoming “A Nonsense Christmas With Sabrina Carpenter,” has hired Adam Stotsky in a new, dual role. Stotsky, who most recently served as president of Dick Clark …",Variety,https://variety.com/2024/tv/news/adam-stotsky-joins-obb-media-bolded-president-1236185084/,22-10-2024 13:00,obb medium production company behind demi lovatos recent hulu doc child star netflixs upcoming nonsense christmas sabrina carpenter hired adam stotsky new dual role stotsky recently served president dick clark
Trinny Woodall built a $72 million-a-year beauty empire in her 50’s—here’s how she spends her new income,"The TV star-turned-entrepreneur commutes to work in a black cab, walks her dogs in Hyde Park and doesn’t have a work wardrobe.",Fortune,https://fortune.com/europe/2024/10/22/trinny-woodall-beauty-empire-in-her-50-london-new-income/,22-10-2024 06:00,tv starturnedentrepreneur commute work black cab walk dog hyde park doesnt work wardrobe
"Simran Bhogal, the catfisher behind Netflix's 'Sweet Bobby,' has managed to completely scrub herself from the internet","Netflix's ""Sweet Bobby"" follows an eight-year catfishing story. Here's what we know about the catfisher, Simran Bhogal.",Business Insider,https://www.businessinsider.com/where-is-simran-bhogal-now-sweet-bobby,21-10-2024 19:11,netflixs sweet bobby follows eightyear catfishing story here know catfisher simran bhogal
Gaming's Consolidation Spree Is Far From Over,"Despite the harsh conditions the last year has left gaming in, social platforms such as Roblox and Fortnite continue to evolve into venues where people can hang out and participate in non-gaming activities.",International Business Times,https://www.ibtimes.com/gamings-consolidation-spree-far-over-3747546,21-10-2024 17:47,despite harsh condition last year left gaming social platform roblox fortnite continue evolve venue people hang participate nongaming activity
Trump Vs. Harris Fundraising Race: Harris Takes In $222 Million In September—Far Surpassing Trump,Harris' campaign and affiliated groups have already raised $1 billion since she entered the race.,Forbes,https://www.forbes.com/sites/alisondurkee/2024/10/21/trump-vs-harris-fundraising-race-harris-takes-in-222-million-in-september-far-surpassing-trump/,21-10-2024 13:56,harris campaign affiliated group already raised billion since entered race
"Market Digest: ABT, KEY, MAN, NFLX, PPG, BMI","Find the latest Netflix, Inc. (NFLX) stock forecast based on top analyst's estimates, plus more investing and trading data from Yahoo Finance",Yahoo Entertainment,https://finance.yahoo.com/research/reports/ARGUS_41572_MarketSummary_1729509171000/,21-10-2024 11:12,find latest netflix inc nflx stock forecast based top analyst estimate plus investing trading data yahoo finance
Stock market today: Asian markets are mostly higher after another winning close on Wall Street,Asian shares are mostly higher after U.S. stocks rose to records to close out their latest winning week,ABC News,https://abcnews.go.com/US/wireStory/stock-market-today-asian-markets-higher-after-winning-114980292,21-10-2024 05:42,asian share mostly higher u stock rose record close latest winning week
Stock market today: Asian markets are mostly higher after another winning close on Wall Street,"Asian shares are mostly higher after U.S. stocks rose to records to close out their latest winning week. U.S. futures and oil prices also climbed. Hong Kong fell but other major Asian markets advanced. On Friday, the S&P 500 climbed 0.4% to squeak past the al…",seattlepi.com,https://www.seattlepi.com/news/world/article/stock-market-today-asian-markets-are-mostly-19850976.php,21-10-2024 05:35,asian share mostly higher u stock rose record close latest winning week u future oil price also climbed hong kong fell major asian market advanced friday sp climbed squeak past al
Stock market today: Asian markets are mostly higher after another winning close on Wall Street,Asian shares are mostly higher after U.S. stocks rose to records to close out their latest winning week,ABC News,https://abcnews.go.com/Business/wireStory/stock-market-today-asian-markets-higher-after-winning-114980293,21-10-2024 05:34,asian share mostly higher u stock rose record close latest winning week
Stock market today: Asian markets are mostly higher after another winning close on Wall Street,Asian shares have opened mostly higher after U.S. stocks rose to records to close out their latest winning week. U.S. futures and oil prices also climbed...,Yahoo Entertainment,https://finance.yahoo.com/news/stock-market-today-asian-markets-052201976.html,21-10-2024 05:22,asian share opened mostly higher u stock rose record close latest winning week u future oil price also climbed
"Spanish TV Producers Target Opportunities, Navigating the Rocky International Scene","Spanish TV fiction producers are finding ways to navigate the rocky international scene thanks to increasing interest from foreign producers looking to co-finance in Spain, leveraging the country’s generous tax incentives. Apart from streamer financing — whic…",Variety,https://variety.com/2024/tv/global/the-mediapro-studio-zeta-studios-secuoya-studios-1236182108/,21-10-2024 04:31,spanish tv fiction producer finding way navigate rocky international scene thanks increasing interest foreign producer looking cofinance spain leveraging country generous tax incentive apart streamer financing whic
"Share Market Highlights October 21, 2024: Sensex closes at 81,151; Nifty falls 73 points amid record FII outflows","Sensex, Nifty updates on October 21, 2024: Equity benchmark indices Sensex and Nifty gave up initial gains and ended lower on Monday tracking a sharp fall in Kotak Mahindra Bank and relentless foreign fund outflows. The 30-share Sensex declined 73.48 points o…",BusinessLine,https://www.thehindubusinessline.com/markets/stock-market-highlights-21-october-2024/article68775545.ece,21-10-2024 01:20,sensex nifty update october equity benchmark index sensex nifty gave initial gain ended lower monday tracking sharp fall kotak mahindra bank relentless foreign fund outflow share sensex declined point
"Nearly $25 million spent on Colorado ballot measures — led by backers of election overhaul, abortion amendment",Spending on the litany of measures on Coloradans' ballots has surpassed $24.5 million.,The Denver Post,https://www.denverpost.com/2024/10/20/colorado-ballot-measures-campaign-spending-elections-voting-abortion-schools/,20-10-2024 12:00,spending litany measure coloradan ballot surpassed million
"All You Need To Know About Seema Sajdeh's Boyfriend, Vikram Ahuja","Previously married to actor Sohail Khan, Seema Sajdeh is now dating her ex-fiance Vikram Ahuja",NDTV News,https://www.ndtv.com/entertainment/who-is-vikram-ahuja-the-man-seema-sajdeh-is-dating-after-divorce-from-sohail-khan-6831064,20-10-2024 09:21,previously married actor sohail khan seema sajdeh dating exfiance vikram ahuja
Netflix price target raised to $800 from $740 at BofA,"Netflix price target raised to $800 from $740 at BofA Yahoo Finance
Is Netflix Stock Heading To $900 After Q3 Earnings? Barchart
Netflix Stock At All-Time High As Profits Surge: See New Names On IBD 50, Stock Spotlight And More Investor's Business Daily
Netfl…",Biztoc.com,https://biztoc.com/x/76569da3f1c8e7d8,20-10-2024 08:46,netflix price target raised bofa yahoo finance netflix stock heading q earnings barchart netflix stock alltime high profit surge see new name ibd stock spotlight investor business daily netfl
Ahead of Market: 10 things that will decide stock action on Monday,"Indian equity indices Sensex and Nifty50 ended a three-day losing streak, driven by Axis Bank gains, despite foreign fund outflows causing a third consecutive weekly loss for benchmarks.",The Times of India,https://economictimes.indiatimes.com/markets/stocks/news/ahead-of-market-10-things-that-will-decide-stock-action-on-monday/articleshow/114393435.cms,20-10-2024 07:42,indian equity index sensex nifty ended threeday losing streak driven axis bank gain despite foreign fund outflow causing third consecutive weekly loss benchmark
Netflix Raises Prices As Password Boost Fades,"Netflix Raises Prices As Password Boost Fades Slashdot
Will Netflix raise prices again? Analysts think so Fox Business
Netflix will 'continue to evolve' its pricing model but loves 'the low price point' of its $6.99 ads plan Yahoo Finance
Netflix Price Hikes:…",Biztoc.com,https://biztoc.com/x/e28f9fc1a68b0229,19-10-2024 17:52,netflix raise price password boost fade slashdot netflix raise price analyst think fox business netflix continue evolve pricing model love low price point ad plan yahoo finance netflix price hike
Dow and S&P 500 end week at fresh record closes,"Dow and S&P 500 end week at fresh record closes CNBC Television
Stock market today: S&P 500 sets record, longest weekly win streak of 2024 as Netflix surges Yahoo Finance
Dow closes at another record high as chip stocks, retail data support Reuters
Stock Mark…",Biztoc.com,https://biztoc.com/x/115a8c19e91b1ccc,19-10-2024 06:39,dow sp end week fresh record close cnbc television stock market today sp set record longest weekly win streak netflix surge yahoo finance dow close another record high chip stock retail data support reuters stock mark
"Stock market today: S&P 500 heads for record, longest weekly win streak of 2024 as Netflix surges - Yahoo Finance","Stock market today: S&amp;P 500 heads for record, longest weekly win streak of 2024 as Netflix surgesYahoo Finance View Full Coverage on Google News ...",Slashdot.org,https://slashdot.org/firehose.pl?op=view&amp;id=175281407,19-10-2024 00:52,stock market today sampp head record longest weekly win streak netflix surgesyahoo finance view full coverage google news
"Dow and S&P end at fresh record highs, lifted by Netflix earnings and tech stocks - Reuters","Dow and S&P end at fresh record highs, lifted by Netflix earnings and tech stocksReuters Dow, S&P 500 close at record highs and mark the year's longest winning streakCNBC Dow and S&P 500 notch closing highs, lifted by tech stocksYahoo Finance Stock Market New…",Slashdot.org,https://slashdot.org/firehose.pl?op=view&amp;id=175281343,19-10-2024 00:32,dow sp end fresh record high lifted netflix earnings tech stocksreuters dow sp close record high mark year longest winning streakcnbc dow sp notch closing high lifted tech stocksyahoo finance stock market new
"Dow, S&P 500 close at record highs and mark the year's longest winning streak - CNBC","Dow, S&P 500 close at record highs and mark the year's longest winning streakCNBC Dow and S&P 500 notch closing highs, lifted by tech stocksYahoo Finance Stock Market News, Oct. 18, 2024: Netflix Stock Jumps on Earnings; Amex Weighs on DowThe Wall Street Jour…",Slashdot.org,https://slashdot.org/firehose.pl?op=view&amp;id=175281125,18-10-2024 23:53,dow sp close record high mark year longest winning streakcnbc dow sp notch closing high lifted tech stocksyahoo finance stock market news oct netflix stock jump earnings amex weighs dowthe wall street jour
"김건희 게이트(2024 Election, War and Rich) 217","US housing starts eased in September as a drop in multifamily projects outweighed a pickup in construction of single-family dwellings https://t.co/WkPVqFRbo6— Bloomberg Economics (@economics) October 18, 2024 The ""Yes In God's Backyard"" movement seeks to conv…",Tistory.com,https://ryueyes11.tistory.com/511112,18-10-2024 23:18,u housing start eased september drop multifamily project outweighed pickup construction singlefamily dwelling bloomberg economics economics october yes god backyard movement seek conv
'Monsters' Actor Nicholas Alexander Chavez Meets Jude Law & Nicholas Hoult at 'The Order' Screening,"Nicholas Alexander Chavez is rubbing shoulders with some famous faces amid the success of his Netflix series Monsters: The Lyle and Erik Menendez Story! The 25-year-old actor, who also stars in Ryan Murphy‘s new series Grotesquerie, attended the CAA Tastemake…",Just Jared,https://www.justjared.com/2024/10/18/monsters-actor-nicholas-alexander-chavez-meets-jude-law-nicholas-hoult-at-the-order-screening/,18-10-2024 20:48,nicholas alexander chavez rubbing shoulder famous face amid success netflix series monster lyle erik menendez story yearold actor also star ryan murphy new series grotesquerie attended caa tastemake
"Stock market today: S&P 500 sets record, longest weekly win streak of 2024 as Netflix surges - Yahoo Finance","Stock market today: S&P 500 sets record, longest weekly win streak of 2024 as Netflix surgesYahoo Finance Stocks rise Friday, head for 6-week winning streak on strong earnings: Live updatesCNBC Dow, S&P 500 close at record highs and mark the year's longest wi…",Slashdot.org,https://slashdot.org/firehose.pl?op=view&amp;id=175279987,18-10-2024 20:32,stock market today sp set record longest weekly win streak netflix surgesyahoo finance stock rise friday head week winning streak strong earnings live updatescnbc dow sp close record high mark year longest wi
"Dow Jones Dips, But Apple Gaps Up On iPhone News; Netflix Soars To All-Time High (Live Coverage)","Dow Jones Dips, But Apple Gaps Up On iPhone News; Netflix Soars To All-Time High (Live Coverage) Investor's Business Daily
Intel, AMD Rise. Why Chip Stock Investors Are Breathing a Sigh of Relief. Barron's
Stock market today: Dow hits fresh record, Nvidia and…",Biztoc.com,https://biztoc.com/x/d87c4502381e8295,18-10-2024 20:21,dow jones dip apple gap iphone news netflix soar alltime high live coverage investor business daily intel amd rise chip stock investor breathing sigh relief barrons stock market today dow hit fresh record nvidia
"Stock market today: S&P 500 sets record, longest weekly win streak of 2024 as Netflix surges","Stock market today: S&P 500 sets record, longest weekly win streak of 2024 as Netflix surges Yahoo Finance
Stock Market Today: Nasdaq, S&P 500 Rise; Netflix, Amex Stocks in Focus — Live Updates The Wall Street Journal
Stocks making the biggest moves premarket…",Biztoc.com,https://biztoc.com/x/e805e3fcfd12de78,18-10-2024 20:20,stock market today sp set record longest weekly win streak netflix surge yahoo finance stock market today nasdaq sp rise netflix amex stock focus live update wall street journal stock making biggest move premarket
"European Film Finance Evolves, Indie Films ‘Under Threat,’ A.I. Struggles to Make Inroads and Other Takeaways From Rome’s MIA Market","The 10th edition of Rome’s MIA Market wrapped on Friday with organizers recording a 10% bump in attendance over the 2023 edition, welcoming more than 2,800 participants from 60 countries to the Eternal City for five days of pitching sessions, panel discussion…",Variety,https://variety.com/2024/tv/global/rome-mia-market-takeaways-1236182147/,18-10-2024 20:08,th edition rome mia market wrapped friday organizer recording bump attendance edition welcoming participant country eternal city five day pitching session panel discussion
"Stock market today: S&P 500 heads for record, longest weekly win streak of 2024 as Netflix surges","Stock market today: S&P 500 heads for record, longest weekly win streak of 2024 as Netflix surges Yahoo Finance
Stock movers: Netflix, Lamb Weston, CVS Health TheStreet
Stock Market Today: Nasdaq, S&P 500 Rise; Netflix, Amex Stocks in Focus — Live Updates The…",Biztoc.com,https://biztoc.com/x/dcaaa5c1f25d7ac6,18-10-2024 19:47,stock market today sp head record longest weekly win streak netflix surge yahoo finance stock mover netflix lamb weston cv health thestreet stock market today nasdaq sp rise netflix amex stock focus live update
"The Apple HomePod speaker, inspired me to setup my smart home",We reviewed Apple’s second-gen HomePod and its high-quality audio and smart home compatibility has made me fall in love with my smart home again.,NBC News,https://www.nbcnews.com/select/shopping/apple-homepod-smart-speaker-review-rcna176091,18-10-2024 18:22,reviewed apple secondgen homepod highquality audio smart home compatibility made fall love smart home
‘Lonely Planet’ Review: Romance is Dead and Netflix Killed It,"Katherine (Laura Dern) is a writer on a fancy writers' retreat in Morocco. This is made clear within the opening minute of the latest paint-by-numbers Netflix flick Lonely Planet, because the film opens with Katherine arriving at the airport in...
Read more...",Pajiba.com,https://www.pajiba.com/film_reviews/lonely-planet-review-romance-is-dead-and-netflix-killed-it.php,18-10-2024 17:47,katherine laura dern writer fancy writer retreat morocco made clear within opening minute latest paintbynumbers netflix flick lonely planet film open katherine arriving airport read
"Stock market today: Nasdaq, S&P 500 step higher as Netflix jumps after earnings beat - Yahoo Finance","Stock market today: Nasdaq, S&P 500 step higher as Netflix jumps after earnings beatYahoo Finance Stocks making the biggest moves midday: Netflix, Apple, CVS Health, Lamb Weston, United States Cellular and moreCNBC Stock Market Today: Nasdaq Rises; Netflix St…",Slashdot.org,https://slashdot.org/firehose.pl?op=view&amp;id=175278299,18-10-2024 16:53,stock market today nasdaq sp step higher netflix jump earnings beatyahoo finance stock making biggest move midday netflix apple cv health lamb weston united state cellular morecnbc stock market today nasdaq rise netflix st
"Nasdaq, S&P 500 Futures Jump Friday: What's Going On - Invesco QQQ Trust, Series 1 (NASDAQ:QQQ), SPDR S&P 500 (ARCA:SPY)","Nasdaq, S&P 500 Futures Jump Friday: What's Going On - Invesco QQQ Trust, Series 1 (NASDAQ:QQQ), SPDR S&P 500 (ARCA:SPY) Benzinga
Stock market today: Nasdaq, S&P 500 step higher as Netflix jumps after earnings beat Yahoo Finance
Stock Market Today: Nasdaq Ris…",Biztoc.com,https://biztoc.com/x/f9aa00041dbbd858,18-10-2024 16:40,nasdaq sp future jump friday whats going invesco qqq trust series nasdaqqqq spdr sp arcaspy benzinga stock market today nasdaq sp step higher netflix jump earnings beat yahoo finance stock market today nasdaq ri
"Netflix stock surges after earnings, subscriber growth top estimates - Yahoo Finance","Netflix stock surges after earnings, subscriber growth top estimatesYahoo Finance Bank of America hikes Nvidia price target, says shares can rally almost 40%CNBC Netflix’s stock is gaining — but investors should get ready for the new realityMarketWatch Netfli…",Slashdot.org,https://slashdot.org/firehose.pl?op=view&amp;id=175277881,18-10-2024 15:32,netflix stock surge earnings subscriber growth top estimatesyahoo finance bank america hike nvidia price target say share rally almost cnbc netflixs stock gaining investor get ready new realitymarketwatch netfli
"Netflix stock surges after earnings, subscriber growth top estimates",Netflix stock is rising after the streaming giant beat third quarter EPS and revenue estimates. Here's what to know.,Yahoo Entertainment,https://finance.yahoo.com/news/netflix-stock-surges-after-earnings-subscriber-growth-top-estimates-133825544.html,18-10-2024 15:27,netflix stock rising streaming giant beat third quarter eps revenue estimate here know
Netflix raises prices as password boost fades,"Netflix raises prices as password boost fades BBC.com
Netflix will 'continue to evolve' its pricing model but loves 'the low price point' of its $6.99 ads plan Yahoo Finance
Netflix hints at when subscriber rates may rise TheStreet
Can Netflix Keep Flexing It…",Biztoc.com,https://biztoc.com/x/38ae84a7fac39cca,18-10-2024 15:23,netflix raise price password boost fade bbccom netflix continue evolve pricing model love low price point ad plan yahoo finance netflix hint subscriber rate may rise thestreet netflix keep flexing
