Title,Description,Publisher,Link,Published Time,processed_text
"U.S. Tech Billionaire Ventures Into U.K.’s Buy Now, Pay Later Market","Max Levchin’s fintech giant Affirm has launched its services in the U.K., marking the company’s first expansion outside of the U.S. and Canada.",Forbes,https://www.forbes.com/sites/robertolsen-1/2024/11/04/us-tech-billionaire-ventures-into-uks-buy-now-pay-later-market/,04-11-2024 16:05,max levchins fintech giant affirm launched service uk marking company first expansion outside u canada
Nigerian man Sentenced to 26+ years in real estate phishing scams,Nigerian Kolade Ojelade gets 26 years in U.S. for phishing scams that stole millions by hacking email accounts. A Nigerian national was sentenced to 26 years in prison in the US for stealing millions by compromising the email accounts of real estate businesse…,Securityaffairs.com,https://securityaffairs.com/170561/cyber-crime/nigerian-man-26-years-jail-phishing-scams.html,04-11-2024 14:28,nigerian kolade ojelade get year u phishing scam stole million hacking email account nigerian national sentenced year prison u stealing million compromising email account real estate businesse
Business professionals + GenAI: saving time and increasing performance,"Last week, we shared career development tips from Tony Francis, a Senior Program Manager and data analytics expert at Google. There, Francis shared insights he gleaned from his own professional journey, which saw him go from a finance and accounting major wit…",Coursera.org,https://blog.coursera.org/business-professionals-genai-saving-time-and-increasing-performance/,04-11-2024 14:24,last week shared career development tip tony francis senior program manager data analytics expert google francis shared insight gleaned professional journey saw go finance accounting major wit
ChatGPT Search Vs. Google Vs. Bing Search Results,"To compare the search results in ChatGPT to Bing and Google, Dan looked at a number of queries to understand the possibility and limitations of SearchGPT",Search Engine Journal,https://www.searchenginejournal.com/chatgpt-search-vs-google-and-bing/531573/,04-11-2024 14:02,compare search result chatgpt bing google dan looked number query understand possibility limitation searchgpt
Press release: Do one thing – get on the HMRC app,HMRC is reminding people to download the HMRC app to access HMRC services such as Child Benefit and their National Insurance number.,Www.gov.uk,https://www.gov.uk/government/news/do-one-thing-get-on-the-hmrc-app,04-11-2024 10:57,hmrc reminding people download hmrc app access hmrc service child benefit national insurance number
"The hour of reckoning in the US, oligarchs applying pressure and making demands, the cabinet reshuffle and Schinas, the tax troubles of Kasselakis’ father with the IRS","Hello, the hour of reckoning has arrived for the new leader of the free world, and naturally, this week, something quite dramatic would need to happen to shift the spotlight from this major event that occurs once every four years and politically, geostrategic…",Protothema.gr,https://en.protothema.gr/2024/11/04/the-hour-of-reckoning-in-the-us-oligarchs-applying-pressure-and-making-demands-the-cabinet-reshuffle-and-schinas-the-tax-troubles-of-kasselakis-father-with-the-irs/,04-11-2024 10:12,hello hour reckoning arrived new leader free world naturally week something quite dramatic would need happen shift spotlight major event occurs every four year politically geostrategic
Russian disinformation campaign active ahead of 2024 US election,"U.S. intel says Russia made a fake video claiming Haitians voted illegally in Georgia, aiming to spread election disinformation. U.S. intel reports Russia created a fake viral video falsely claiming Haitians illegally voted multiple times in Georgia, aiming t…",Securityaffairs.com,https://securityaffairs.com/170551/intelligence/russia-disinformation-us-election-2024.html,04-11-2024 10:07,u intel say russia made fake video claiming haitian voted illegally georgia aiming spread election disinformation u intel report russia created fake viral video falsely claiming haitian illegally voted multiple time georgia aiming
Will we ever have quantum laptops?,Quantum computers are here. But could we ever build a quantum laptop?,Live Science,https://www.livescience.com/technology/computing/will-we-ever-have-quantum-laptops,04-11-2024 10:00,quantum computer could ever build quantum laptop
Weekly Climate and Energy News Roundup #618,"“Collective fear stimulates herd instinct and tends to produce ferocity toward those who are not regarded as members of the herd."" — Bertrand Russell, Unpopular Essays",Wattsupwiththat.com,https://wattsupwiththat.com/2024/11/04/weekly-climate-and-energy-news-roundup-618/,04-11-2024 10:00,collective fear stimulates herd instinct tends produce ferocity toward regarded member herd bertrand russell unpopular essay
36 Google Ads Statistics You Should Know,Discover the latest Google Ads statistics. Stay ahead with industry-specific data and trend forecasts.,Semrush.com,https://www.semrush.com/blog/google-ads-statistics/,04-11-2024 09:27,discover latest google ad statistic stay ahead industryspecific data trend forecast
"Generative AI faces bottlenecks from limited data, rising resource demands, and copper shortages","Generative AI requires ample resources, yet challenges such as limited high-quality data, rising freshwater and electricity consumption in data centers, and a widening copper supply gap may emerge as critical bottlenecks to AI progress.",Digitimes,https://www.digitimes.com/news/a20241031PD212/genai-data-demand-copper.html,04-11-2024 07:27,generative ai requires ample resource yet challenge limited highquality data rising freshwater electricity consumption data center widening copper supply gap may emerge critical bottleneck ai progress
International law enforcement operation shut down DDoS-for-hire platform Dstat.cc,"German police shut down DDoS-for-hire platform Dstat.cc and arrested two men accused of operating the site used for launching DDoS attacks. German police shut down the DDoS-for-hire platform Dstat.cc that allowed its customers to launch DDoS attacks. Two men,…",Securityaffairs.com,https://securityaffairs.com/170540/cyber-crime/german-police-shut-down-ddos-for-hire-platform-dstat-cc.html,04-11-2024 06:24,german police shut ddosforhire platform dstatcc arrested two men accused operating site used launching ddos attack german police shut ddosforhire platform dstatcc allowed customer launch ddos attack two men
"Boost your career with LinkedIn: How to optimise your profile to find a job, grow the network and build your brand","Whether you are searching for a job, or expanding your business, or connecting with professionals and growing your network, a polished LinkedIn profile is sure to boost your chances. Here’s how you can do it.",The Times of India,https://economictimes.indiatimes.com/wealth/earn/boost-your-career-with-linkedin-how-to-optimise-your-profile-to-find-a-job-grow-the-network-and-build-your-brand/articleshow/114855952.cms,04-11-2024 01:00,whether searching job expanding business connecting professional growing network polished linkedin profile sure boost chance here
"Interest in 'Travel Tuesday' soars, with more consumers saying they prefer travel to shopping","Search interest for ""Travel Tuesday"" rose more than 500% over the last two years, according to a report published Thursday by McKinsey & Company.",CNBC,https://www.cnbc.com/2024/11/04/travel-tuesday-2024-searches-soar-as-shoppers-want-travel-over-stuff-.html,03-11-2024 22:55,search interest travel tuesday rose last two year according report published thursday mckinsey company
Solana DeFi Momentum Soars With $5.7 Billion Locked In Q3,"Solana continues to prove that it’s one of the top blockchains for this cycle. After its rally, which gained 35% over the past 60 days, the popular Layer 1 blockchain is back in the news with more on-chain activities. According to recent data, Solana’s DeFi T…",newsBTC,http://www.newsbtc.com/news/solana-defi-momentum-soars-with-5-7-billion-locked-in-q3/,03-11-2024 22:00,solana continues prove one top blockchains cycle rally gained past day popular layer blockchain back news onchain activity according recent data solanas defi
SECURITY AFFAIRS MALWARE NEWSLETTER – ROUND 18,Security Affairs Malware newsletter includes a collection of the best articles and research on malware in the international landscape. Security Affairs Malware newsletter includes a collection of the best articles and research on malware in the international …,Securityaffairs.com,https://securityaffairs.com/170532/malware/security-affairs-malware-newsletter-round-18.html,03-11-2024 14:23,security affair malware newsletter includes collection best article research malware international landscape security affair malware newsletter includes collection best article research malware international
Security Affairs newsletter Round 496 by Pierluigi Paganini – INTERNATIONAL EDITION,"A new round of the weekly SecurityAffairs newsletter arrived! Every week the best security articles from Security Affairs are free in your email box. Enjoy a new round of the weekly SecurityAffairs newsletter, including the international press. Chinese threat…",Securityaffairs.com,https://securityaffairs.com/170525/breaking-news/security-affairs-newsletter-round-496-by-pierluigi-paganini-international-edition.html,03-11-2024 14:13,new round weekly securityaffairs newsletter arrived every week best security article security affair free email box enjoy new round weekly securityaffairs newsletter including international press chinese threat
US Election 2024 – FBI warning about fake election videos,"US Election 2024 – The FBI warned that two fake videos on X spread false claims of ballot fraud and misinformation about Kamala Harris’s husband. In a post on X on Saturday, the Federal Bureau of Investigation (FBI) said the two videos were spreading rumours …",Securityaffairs.com,https://securityaffairs.com/170514/security/us-election-2024-fbi-warning-about-fake-election-videos.html,03-11-2024 12:10,u election fbi warned two fake video x spread false claim ballot fraud misinformation kamala harris husband post x saturday federal bureau investigation fbi said two video spreading rumour
Chinese threat actors use Quad7 botnet in password-spray attacks,"Microsoft warns Chinese threat actors are using the Quad7 botnet to carry out password-spray attacks and steal credentials. Chinese threat actors use the Quad7 botnet in password-spray attacks to steal credentials, Microsoft warns. Quad7 botnet, also known as…",Securityaffairs.com,https://securityaffairs.com/170503/malware/quad7-botnet-used-by-chinese-threat-actors.html,03-11-2024 10:09,microsoft warns chinese threat actor using quad botnet carry passwordspray attack steal credential chinese threat actor use quad botnet passwordspray attack steal credential microsoft warns quad botnet also known
"Week in review: Windows Themes spoofing bug “returns”, employees phished via Microsoft Teams","Here’s an overview of some of last week’s most interesting news, articles, interviews and videos: Patching problems: The “return” of a Windows Themes spoofing vulnerability Despite two patching attempts, a security issue that may allow attackers to compromise…",Help Net Security,https://www.helpnetsecurity.com/2024/11/03/week-in-review-windows-themes-spoofing-bug-returns-employees-phished-via-microsoft-teams/,03-11-2024 09:00,here overview last week interesting news article interview video patching problem return window theme spoofing vulnerability despite two patching attempt security issue may allow attacker compromise
Lawmakers are vetting the EU chief's new team. It might be tough but she has the right on her side,The influence of nationalist and populist parties on the European Union will be on public display next week when lawmakers vet new members of the bloc's increasingly powerful executive branch,ABC News,https://abcnews.go.com/International/wireStory/lawmakers-vetting-eu-chiefs-new-team-tough-side-115436406,03-11-2024 08:20,influence nationalist populist party european union public display next week lawmaker vet new member bloc increasingly powerful executive branch
"Big Tech doubles down on AI, $200 billion gamble raises concerns on Wall Street - TechSpot","Big Tech doubles down on AI, $200 billion gamble raises concerns on Wall StreetTechSpot Amazon, Google show profit growth can quiet fears over heavy AI spendingYahoo Finance Tech Giants Are Set to Spend $200 Billion This Year Chasing AIBloomberg What We Learn…",Slashdot.org,https://slashdot.org/firehose.pl?op=view&amp;id=175383935,03-11-2024 03:32,big tech double ai billion gamble raise concern wall streettechspot amazon google show profit growth quiet fear heavy ai spendingyahoo finance tech giant set spend billion year chasing aibloomberg learn
Hunt for Bitcoin's elusive creator Satoshi Nakamoto hits another dead-end,Why are still no closer to unmasking the mysterious Satoshi Nakamoto?,BBC News,https://www.bbc.com/news/articles/c079zp2vy31o,03-11-2024 00:51,still closer unmasking mysterious satoshi nakamoto
Why Jamie Dimon is Sam Altman’s biggest competitor,"Investors have poured north of $30 billion into independent foundation model players, including OpenAI, Anthropic PBC, Cohere Inc. and Mistral AI as well as others. OpenAI itself has raised more than $20 billion. To keep pace, both Meta Platforms Inc. and xAI…",SiliconANGLE News,https://siliconangle.com/2024/11/02/jamie-dimon-sam-altmans-biggest-competitor/,02-11-2024 19:02,investor poured north billion independent foundation model player including openai anthropic pbc cohere inc mistral ai well others openai raised billion keep pace meta platform inc xai
"Nvidia to join Dow Jones Industrial Average, replacing rival chipmaker Intel","Nvidia is replacing rival chipmaker Intel in the Dow Jones Industrial Average, a shakeup to the blue-chip index that reflects the boom in artificial intelligence and a major shift in the semiconductor industry.",NBC News,https://www.nbcnews.com/business/nvidia-replaces-intel-dow-jones-rcna178524,02-11-2024 18:31,nvidia replacing rival chipmaker intel dow jones industrial average shakeup bluechip index reflects boom artificial intelligence major shift semiconductor industry
FBI arrested former Disney World employee for hacking computer menus and mislabeling allergy info,"A former Disney World employee hacked servers after being fired, altering prices, adding profanities, and mislabeling allergy info. A former Walt Disney World employee hacked servers after being fired by the company. He is accused of changing prices, adding p…",Securityaffairs.com,https://securityaffairs.com/170489/cyber-crime/former-disney-world-employee-arrested.html,02-11-2024 18:17,former disney world employee hacked server fired altering price adding profanity mislabeling allergy info former walt disney world employee hacked server fired company accused changing price adding p
A Trauma of Money-certified coach shares the book that changed her money mindset and helped her tackle credit card debt,"Morgan Housel's ""The Psychology of Money"" could change your mindset about money, too.",Business Insider,https://www.businessinsider.com/money-coach-shares-top-book-recommendation-the-psychology-of-money-2024-11,02-11-2024 18:03,morgan housels psychology money could change mindset money
NVIDIA Replaces Rival Chipmaker Intel on the Dow Jones Industrial Average,"In 1896 the Dow Jones Industrial Average (or DJIA) was created as a kind of proxy indicator for the wider stock market. ""A stock is typically added only if the company has an excellent reputation, demonstrates sustained growth and is of interest to a large nu…",Slashdot.org,https://hardware.slashdot.org/story/24/11/02/0328233/nvidia-replaces-rival-chipmaker-intel-on-the-dow-jones-industrial-average,02-11-2024 17:34,dow jones industrial average djia created kind proxy indicator wider stock market stock typically added company excellent reputation demonstrates sustained growth interest large nu
Sophos details five years of China-linked threat actors’ activity targeting network devices worldwide,"Sophos used custom implants to monitor China-linked thret actors targeting firewall zero-days in a years-long battle. Sophos revealed a years-long “cat-and-mouse” battle with China-linked threat actors, using custom implants to track the attackers’ activities…",Securityaffairs.com,https://securityaffairs.com/170469/apt/china-linked-threat-actors-activity-targeting-network-devices-worldwide.html,02-11-2024 16:12,sophos used custom implant monitor chinalinked thret actor targeting firewall zerodays yearslong battle sophos revealed yearslong catandmouse battle chinalinked threat actor using custom implant track attacker activity
"Donald Trump가 미국 경제와 자산시장을 ""관세""로 작살, ""이민법"" 공약으로 박살낼 것","A murdered priest, a beheaded mayor, car bombs and an all-out cartel war have stained Mexican President Claudia Sheinbaum’s first month in office https://t.co/4jX6IGNKs8— Bloomberg Economics (@economics) November 1, 2024 ""The election is going to have... thre…",Tistory.com,https://ryueyes11.tistory.com/511221,02-11-2024 12:13,murdered priest beheaded mayor car bomb allout cartel war stained mexican president claudia sheinbaums first month office bloomberg economics economics november election going thre
Google's cloud outpaces rivals in third quarter as AI battle heats up,One takeaway from tech earnings reports this week is that Google's cloud business is gaining momentum.,CNBC,https://www.cnbc.com/2024/11/02/googles-cloud-outpaces-aws-azure-in-q3-as-ai-battle-heats-up-.html,02-11-2024 12:00,one takeaway tech earnings report week google cloud business gaining momentum
I’ve Served Time in “Club Fed.” Here’s Some Advice for Trump If He Loses.,"I never paid much attention to America’s criminal justice system until I, unexpectedly, got into serious trouble. Being labeled a criminal felt to me as unlikely as someone finding Kool-Aid on Jupiter. I was the rarest of things, an honest dealer among the my…",Mother Jones,https://www.motherjones.com/politics/2024/11/trump-loss-federal-prison-advice-essay/,02-11-2024 10:00,never paid much attention america criminal justice system unexpectedly got serious trouble labeled criminal felt unlikely someone finding koolaid jupiter rarest thing honest dealer among
I’ve Served Time in “Club Fed.” Here’s Some Advice for Trump If He Loses.,"I never paid much attention to America’s criminal justice system until I, unexpectedly, got into serious trouble. Being labeled a criminal felt to me as unlikely as someone finding Kool-Aid on Jupiter. I was the rarest of things, an honest dealer among the my…",Mother Jones,https://www.motherjones.com/politics/2024/11/ive-served-time-in-club-fed-heres-some-advice-for-trump-if-he-loses/,02-11-2024 10:00,never paid much attention america criminal justice system unexpectedly got serious trouble labeled criminal felt unlikely someone finding koolaid jupiter rarest thing honest dealer among
"Tesla, AMD And Nvidia Show Higher Volatility Than Bitcoin In October 2024","Leading tech stocks display greater price fluctuations than bitcoin, reflecting evolving digital asset trends.",Forbes,https://www.forbes.com/sites/digital-assets/2024/11/02/tesla-amd-and-nvidia-show-higher-volatility-than-bitcoin-in-october-2024/,02-11-2024 08:25,leading tech stock display greater price fluctuation bitcoin reflecting evolving digital asset trend
PTZOptics cameras zero-days actively exploited in the wild,"Hackers are exploiting two zero-day vulnerabilities, tracked as CVE-2024-8956 and CVE-2024-8957, in PTZOptics cameras. Threat actors are attempting to exploit two zero-day vulnerabilities, tracked as CVE-2024-8956 and CVE-2024-8957, in PTZOptics pan-tilt-zoom…",Securityaffairs.com,https://securityaffairs.com/170456/hacking/ptzoptics-cameras-flaws-exploited.html,02-11-2024 07:16,hacker exploiting two zeroday vulnerability tracked cve cve ptzoptics camera threat actor attempting exploit two zeroday vulnerability tracked cve cve ptzoptics pantiltzoom
Life certificate: How can pensioners submit Jeevan Pramaan Patra offline and online,"To avoid payment disruptions, pensioners must submit their annual life certificates by November 30. The submission period for those under 80 began on November 1",Livemint,https://www.livemint.com/money/personal-finance/life-certificate-how-can-pensioners-submit-jeevan-pramaan-patra-offline-and-online-11730527656915.html,02-11-2024 06:49,avoid payment disruption pensioner must submit annual life certificate november submission period began november
Can anyone besides Nvidia make big bucks from chips?,The strange economics of the semiconductor supply chain,Livemint,https://www.livemint.com/industry/can-anyone-besides-nvidia-make-big-bucks-from-chips-11730525986460.html,02-11-2024 05:44,strange economics semiconductor supply chain
Wine Web and a whole lot of Whatnot,"We join the Whiskey Web and Whatnot podcast live from the hallway track at All Things Open 2024. Topics include: Chianti, content creation, open source, fake jobs, cancel culture, Silicon Valley (ding), frontend frustrations, the Roman empire & more.",Changelog.com,https://changelog.com/friends/68,01-11-2024 21:00,join whiskey web whatnot podcast live hallway track thing open topic include chianti content creation open source fake job cancel culture silicon valley ding frontend frustration roman empire
New LightSpy spyware version targets iPhones with destructive capabilities,"New LightSpy spyware targets iPhones supporting destructive features that can block compromised devices from booting up. In May 2024, ThreatFabric researchers discovered a macOS version of LightSpy spyware that has been active in the wild since at least Janua…",Securityaffairs.com,https://securityaffairs.com/170447/malware/lightspy-spyware-targets-iphones.html,01-11-2024 19:51,new lightspy spyware target iphones supporting destructive feature block compromised device booting may threatfabric researcher discovered macos version lightspy spyware active wild since least janua
Our editors’ favorite products from October,"NBC Select editors recommend their favorite products from October 2024. Shop standout items from Ikea, Merit and Calpak.",NBC News,https://www.nbcnews.com/select/shopping/editor-favorites-october-rcna123403,01-11-2024 17:38,nbc select editor recommend favorite product october shop standout item ikea merit calpak
LottieFiles confirmed a supply chain attack on Lottie-Player,"LottieFiles confirmed a supply chain attack on Lottie-Player, and threat actors targeted cryptocurrency wallets to steal funds. LottieFiles confirmed that threat actors have hacked the Lottie-Player software in a supply chain attack. Lottie-Player is a web co…",Securityaffairs.com,https://securityaffairs.com/170441/hacking/lottiefiles-confirmed-a-supply-chain-attack-on-lottie-player.html,01-11-2024 17:37,lottiefiles confirmed supply chain attack lottieplayer threat actor targeted cryptocurrency wallet steal fund lottiefiles confirmed threat actor hacked lottieplayer software supply chain attack lottieplayer web co
#2268 How is beehiiv making $15 mil per year?,"They feel like the millionth company to offer email newsletter publishing. How are they growing so fast despite the competition?
Tyler Denk is a big reason. A former Morning Brew employee, he took their growth techniques and turned them into a software compan…",Mixergy.com,https://mixergy.com/interviews/how-is-beehiiv-making-15-mil-per-year/,01-11-2024 17:00,feel like millionth company offer email newsletter publishing growing fast despite competition tyler denk big reason former morning brew employee took growth technique turned software compan
Saudi Wants To Use Its Oil Billions To Become An AI Power Player,"Cash, land and cheap renewable energy were key parts of the kingdom’s pitch to become a “global hub for AI” at its annual ‘Davos in the desert” summit.",Forbes,https://www.forbes.com/sites/iainmartin/2024/11/01/saudi-wants-to-use-its-oil-billions-to-become-an-ai-power-player/,01-11-2024 15:24,cash land cheap renewable energy key part kingdom pitch become global hub ai annual davos desert summit
What this VC firm can teach other companies about decarbonizing for real,"Measuring climate impact can be a trust builder, says Eclipse Ventures partner Aidan Madigan-Curtis.",Fortune,https://fortune.com/2024/11/01/eclipse-venture-capital-decarbonizing/,01-11-2024 14:21,measuring climate impact trust builder say eclipse venture partner aidan madigancurtis
"AI Update, November 1, 2024: AI News and Views From the Past Week",Catch up on select AI news and developments from the past week or so. Stay in the know. Read the full article at MarketingProfs,MarketingProfs.com,https://www.marketingprofs.com/opinions/2024/52275/ai-update-november-1-2024-ai-news-and-views-from-the-past-week,01-11-2024 14:00,catch select ai news development past week stay know read full article marketingprofs
5 Profitable AI Businesses You Can Start Today,Find out which types of AI business are gaining fast traction. Turn AI trends into repeatable revenue when you start one of your own.,Forbes,https://www.forbes.com/sites/jodiecook/2024/11/01/5-profitable-ai-businesses-you-can-start-today/,01-11-2024 13:00,find type ai business gaining fast traction turn ai trend repeatable revenue start one
